NAME,SIZE,LOCATION_HQ,INDUSTRY,RATING_OVERALL,RATING_DI,RATING_CV,RATING_WL,RATING_SM,RATING_CB,RATING_CO,NUM_REVIEWS,DESCRIPTION,MISSION
"Rockstar Games
Part of Take-Two",1001 to 5000 Employees,"New York, NY",Video Games,4.3,4.7,4.4,4.0,4.0,4.3,3.9,See All 236 Reviews,"Rockstar Games doesn't see why only the kids should have all the video game fun. The company, a subsidiary of Take-Two Interactive Software, is a publisher of mature-rated video games including the hugely popular Grand Theft Auto series. Other series titles from the game studio include Midnight Club, Red Dead, Manhunt, and Max Payne. Rockstar Games' titles are available for major gaming platforms, including Sony's Playstation, Microsoft's Xbox, and Nintendo's Wii, as well as for PCs and portable devices such as the Playstation Portable and Nintendo DS. Parent Take-Two does over half of its business in the US; Europe and the Asia Pacific region are its other key markets.",N/A
National Renewable Energy Lab,1001 to 5000 Employees,"Golden, CO",Energy,4.3,4.6,4.5,4.3,4.0,4.1,4.1,See All 370 Reviews,"The National Renewable Energy Laboratory (NREL) is the U.S. Department of Energy's primary national laboratory for renewable energy and energy efficiency research and development.

NREL develops renewable energy and energy efficiency technologies and practices, advances related science and engineering, and transfers knowledge and innovations to address the nation's energy and environmental goals.","Mission: Our emphasis is on a comprehensive energy approach that encompasses the relationship among key systems:

Fuel production
Transportation
The built environment
Electricity generation and delivery.

Our systems integration approach will accelerate the transformation of our nation's energy use and delivery systems.

Our focus is on a clean energy future."
FirstLight Home Care,1001 to 5000 Employees,"Cincinnati, OH",Health Care Services & Hospitals,4.3,4.0,4.3,4.1,4.2,3.7,4.0,See All 251 Reviews,"FirstLight Home Care is a leading provider of non-medical home care, helping individuals in more than 30 states achieve the quality of life they deserve. The company has set a new standard in home care by creating an unmatched Culture of Care that drives industry-leading client and employee satisfaction.

FirstLight is a lifeline not only for seniors but for people recovering from illness, injury or surgery; adults with disabilities; new and busy mothers; veterans; and anyone over the age of 18 who needs extra assistance. Care can be provided at private residences, as well as independent and assisted living communities. Visit www.FirstLightHomeCare.com for information on our Companion, Personal, Dementia, Respite and Veteran Care services.","Mission: The FirstLight Home Care mission is rooted in our Culture of Care, which defines us as caregivers and leads us to play a significant role in our clients' families. We foster healthy relationships for life. We anticipate the needs of those we serve. We are empowered to create a unique, healthy and comfortable environment. We foster teamwork and collaboration. We constantly strive to learn and grow. And we consider ourselves - we expect ourselves - to be so much more than caregivers."
ManTech,5001 to 10000 Employees,"Herndon, VA",Research & Development,4.3,4.3,4.2,4.3,4.1,4.3,4.2,"See All 1,005 Reviews","ManTech was founded in 1968 to provide advanced technological services to the U.S. Government. We began with a single Navy contract to develop war-gaming models for the submarine community. Over the years, our government's technology needs have increased dramatically in scope and sophistication, and we have grown to meet that challenge.

For 5 decades, we kept a careful eye on where emerging technologies were taking the government, and we developed the resources to master those technologies—by staying close to our customers and anticipating their needs, hiring more than 9,000 talented professionals to propel us into the future, and acquiring companies with proven capabilities.

Today, we are a multibillion-dollar public company that provides the innovation, adaptability and critical thinking our government needs for success in defense, intelligence, law enforcement, science, administration, health and other fields—throughout the nation and in many countries around the world. We are now applying the lessons learned in the unforgiving arena of national security to help the private sector protect networks and critical information.",N/A
MedVet,1001 to 5000 Employees,"Worthington, OH",Veterinary Services,4.3,4.2,4.3,3.7,4.1,4.2,4.2,See All 214 Reviews,"MedVet, with headquarters in Columbus, Ohio, is a widely recognized and growing group of emergency and specialty referral veterinary hospitals for companion animals in 15 states.

MedVet, whose mission is leading specialty healthcare for pets, is employee owned and veterinary led. MedVet provides specialty referral services for in-depth patient care, as well as emergency services 24 hours a day, 365 days a year. More than 250,000 pets are treated annually at MedVet’s expanding network of medical centers across the country.

MedVet hospitals were named the American Animal Hospital Association (AAHA) Accredited Referral Practice of the Year in 2014 and 2016, the only group of practices to receive this award twice. For more information on MedVet’s network of medical centers, visit www.medvet.com",N/A
Infineon Technologies,10000+ Employees,"Neubiberg, Germany",Electrical & Electronic Manufacturing,4.2,4.0,4.1,4.0,3.7,3.8,3.7,"See All 1,458 Reviews","Infineon Technologies focuses on the three central challenges facing modern society: Energy Efficiency, Mobility and Security and offers semiconductors and system solutions for automotive and industrial electronics and chip card and security applications.
Infineon’s products stand out for their reliability, their quality excellence and their innovative and leading-edge technology in analog and mixed signal, RF and power as well as embedded control.

With a global presence, Infineon operates through its subsidiaries in the USA from Milpitas, California, in the Asia-Pacific region from Singapore, and in Japan from Tokyo.",N/A
University of Northern Iowa,1001 to 5000 Employees,"Cedar Falls, IA",Colleges & Universities,4.2,2.8,3.6,3.8,3.0,3.5,3.3,See All 115 Reviews,"University of Northern Iowa (UNI) offers more than 120 undergraduate majors and about a dozen graduate and doctoral degree programs to some 13,000 students (about 90% of which are Iowa residents). The school is comprised of five undergraduate colleges (business administration, education, humanities and fine arts, natural sciences, and social and behavioral sciences) and one graduate college consisting of about 40 academic departments. UNI was founded as Iowa State Normal School in 1876. Notable alumni include US Senator Charles Grassley and NFL quarterback Kurt Warner.",N/A
"Wyeth
Acquired by Pfizer",10000+ Employees,"Madison, NJ",Biotech & Pharmaceuticals,4.2,2.0,4.2,3.8,3.7,4.2,3.4,See All 236 Reviews,"Wyeth is wise in the ways of health care. Operating in three segments, the company's largest unit is its Pharmaceuticals business, which sells antidepressant Effexor, arthritis drug Enbrel (with partner Amgen), and vaccine Prevnar, as well as anti-infectives, nutrition and women's health products, gastroenterology drugs, and treatments for hemophilia and cardiovascular conditions. Its Consumer Healthcare unit produces such familiar over-the-counter brands as Advil, Centrum, Robitussin, and ChapStick. Subsidiary Fort Dodge Animal Health makes products for livestock and pets, including vaccines and parasite control products. Wyeth has agreed to be acquired by top drugmaker Pfizer for $68 billion.",N/A
St. Elizabeth Healthcare,5001 to 10000 Employees,"Edgewood, KY",Health Care Services & Hospitals,4.2,4.2,4.2,4.1,3.9,4.0,4.1,See All 208 Reviews,"St. Elizabeth Healthcare is one of the oldest, largest and most respected medical providers in the Greater Cincinnati region. For more than 155 years, St. Elizabeth has been the heart and soul of healthcare in Northern Kentucky. Founded with one small hospital in 1861, St. Elizabeth Healthcare now operates five facilities throughout Northern Kentucky and more than 115 primary care and specialty office locations in Kentucky, Indiana and Ohio. St. Elizabeth is sponsored by the Diocese of Covington and is a member of the Mayo Clinic Care Network. St. Elizabeth is a mission-based organization committed to improving the health of the communities it serves, providing more than $117 million in uncompensated care and benefit to the community in 2017.","Mission: Our mission is to provide comprehensive and compassionate care that improves the health of the people we serve. We accomplish this through state-of the-art technology and our dedicated associates, led by a well-respected board and executive leadership team who love this organization and our community."
Globant,10000+ Employees,"Buenos Aires, Argentina",IT Services,4.2,4.7,4.4,4.3,4.0,3.7,4.1,"See All 2,223 Reviews","We are a digitally native company where innovation, design and engineering meet scale. We use the latest technologies in the digital and cognitive field to transform organizations in every aspect.

We have more than 12,500 employees and we are present in 16 countries working for companies like Google, Rockwell Automation, Electronic Arts and Santander, among others. We were named a Worldwide Leader of Digital Strategy Consulting Services by IDC MarketScape report. We were also featured as a business case study at Harvard, MIT, and Stanford.",N/A
W. L. Gore & Associates,10000+ Employees,"Newark, DE",Industrial Manufacturing,4.2,4.1,4.3,4.3,3.6,3.8,3.6,See All 818 Reviews,"Founders Bill and Vieve Gore started W. L. Gore & Associates in the basement of their home in 1958. The company initially served the electronic products market. Gore has achieved long-term success at translating dreams into tangible, valuable realities for customers and communities around the world.

The 1969 discovery by Bill and Vieve's son, Bob Gore, of a remarkably versatile new polymer led the enterprise into myriad new applications in medical, fabric, pharmaceutical and biotechnology, oil and gas, aerospace, automotive, mobile electronics, music and semiconductor industries. As the company that invented this new polymer, expanded polytetrafluoroethylene (or ePTFE), and introduced it in the marketplace, Gore is committed to remaining a leader in fluoropolymers.

The depth of Gore’s technical know-how has contributed to a wide range of processes and creative, reliable technologies that continue to solve problems and change outcomes for people around the world.",N/A
St. Elizabeth Healthcare,5001 to 10000 Employees,"Edgewood, KY",Health Care Services & Hospitals,4.2,4.2,4.2,4.1,3.9,4.0,4.1,See All 208 Reviews,"St. Elizabeth Healthcare is one of the oldest, largest and most respected medical providers in the Greater Cincinnati region. For more than 155 years, St. Elizabeth has been the heart and soul of healthcare in Northern Kentucky. Founded with one small hospital in 1861, St. Elizabeth Healthcare now operates five facilities throughout Northern Kentucky and more than 115 primary care and specialty office locations in Kentucky, Indiana and Ohio. St. Elizabeth is sponsored by the Diocese of Covington and is a member of the Mayo Clinic Care Network. St. Elizabeth is a mission-based organization committed to improving the health of the communities it serves, providing more than $117 million in uncompensated care and benefit to the community in 2017.","Mission: Our mission is to provide comprehensive and compassionate care that improves the health of the people we serve. We accomplish this through state-of the-art technology and our dedicated associates, led by a well-respected board and executive leadership team who love this organization and our community."
Infineon Technologies,10000+ Employees,"Neubiberg, Germany",Electrical & Electronic Manufacturing,4.2,4.0,4.1,4.0,3.7,3.8,3.7,"See All 1,458 Reviews","Infineon Technologies focuses on the three central challenges facing modern society: Energy Efficiency, Mobility and Security and offers semiconductors and system solutions for automotive and industrial electronics and chip card and security applications.
Infineon’s products stand out for their reliability, their quality excellence and their innovative and leading-edge technology in analog and mixed signal, RF and power as well as embedded control.

With a global presence, Infineon operates through its subsidiaries in the USA from Milpitas, California, in the Asia-Pacific region from Singapore, and in Japan from Tokyo.",N/A
University of Northern Iowa,1001 to 5000 Employees,"Cedar Falls, IA",Colleges & Universities,4.2,2.8,3.6,3.8,3.0,3.5,3.3,See All 115 Reviews,"University of Northern Iowa (UNI) offers more than 120 undergraduate majors and about a dozen graduate and doctoral degree programs to some 13,000 students (about 90% of which are Iowa residents). The school is comprised of five undergraduate colleges (business administration, education, humanities and fine arts, natural sciences, and social and behavioral sciences) and one graduate college consisting of about 40 academic departments. UNI was founded as Iowa State Normal School in 1876. Notable alumni include US Senator Charles Grassley and NFL quarterback Kurt Warner.",N/A
"Wyeth
Acquired by Pfizer",10000+ Employees,"Madison, NJ",Biotech & Pharmaceuticals,4.2,2.0,4.2,3.8,3.7,4.2,3.4,See All 236 Reviews,"Wyeth is wise in the ways of health care. Operating in three segments, the company's largest unit is its Pharmaceuticals business, which sells antidepressant Effexor, arthritis drug Enbrel (with partner Amgen), and vaccine Prevnar, as well as anti-infectives, nutrition and women's health products, gastroenterology drugs, and treatments for hemophilia and cardiovascular conditions. Its Consumer Healthcare unit produces such familiar over-the-counter brands as Advil, Centrum, Robitussin, and ChapStick. Subsidiary Fort Dodge Animal Health makes products for livestock and pets, including vaccines and parasite control products. Wyeth has agreed to be acquired by top drugmaker Pfizer for $68 billion.",N/A
Highmark Residential,1001 to 5000 Employees,"Dallas, TX",Real Estate,4.2,4.1,4.2,4.0,4.1,3.9,3.9,See All 175 Reviews,N/A,N/A
Globant,10000+ Employees,"Buenos Aires, Argentina",IT Services,4.2,4.7,4.4,4.3,4.0,3.7,4.1,"See All 2,222 Reviews","We are a digitally native company where innovation, design and engineering meet scale. We use the latest technologies in the digital and cognitive field to transform organizations in every aspect.

We have more than 12,500 employees and we are present in 16 countries working for companies like Google, Rockwell Automation, Electronic Arts and Santander, among others. We were named a Worldwide Leader of Digital Strategy Consulting Services by IDC MarketScape report. We were also featured as a business case study at Harvard, MIT, and Stanford.",N/A
Virginia Beach CIty Public Schools,10000+ Employees,"Virginia Beach, VA",K-12 Education,4.2,4.0,3.8,3.4,3.3,3.2,3.7,See All 168 Reviews,"With nearly 70,000 students and over 10,000 employees, Virginia Beach City Public Schools continues to be a highly successful, diverse school district and employer of choice.

The City of Virginia Beach, located on the shores of the Atlantic Ocean and the Chesapeake Bay, frequently makes the ""best places"" lists in a number of publications. Articles frequently cite its high performing schools, low crime rate and mild climate as reasons why the area is considered such a desirable place to live.

Known as a vacation destination because of its 22 miles of public beaches, Virginia Beach is also a great place to live, work and play.",N/A
Emser Tile,1001 to 5000 Employees,"Los Angeles, CA",Consumer Products Manufacturing,4.2,4.5,4.3,3.8,4.1,4.3,4.3,See All 253 Reviews,"Emser Tile is the leading designer, marketer and producer of the world's finest tile and natural stone that help dealers, homebuilders, commercial builders, contractors, architects, and designers exceed their customers’ expectations while keeping projects on schedule and within budget.

With 77 locations nationwide, plus 4 state-of-the-art distribution centers and over 3 million square feet of warehouse space, our experienced associates assist with the entire process from materials specification and selection through scheduling and delivery.",N/A
"Booz & Company
Acquired by Strategy&",1001 to 5000 Employees,"New York, NY",Consulting,4.2,3.6,3.5,3.1,3.3,4.1,3.9,See All 374 Reviews,"Strategy& was formed on March 31, 2014, when the firm formerly known as Booz & Company combined with PwC to form a new kind of consulting firm, offering strategy-through-execution services under one roof. Together we bring more than 250 years of experience helping global clients solve their toughest problems.",N/A
Google,10000+ Employees,"Mountain View, CA",Internet,4.5,4.4,4.4,4.3,4.1,4.5,4.3,"See All 18,368 Reviews","Google is not a conventional company, and we don’t intend to become one. True, we share attributes with the world’s most successful organizations – a focus on innovation and smart business practices comes to mind – but even as we continue to grow, we’re committed to retaining a small-company feel. At Google, we know that every employee has something important to say, and that every employee is integral to our success. We provide individually-tailored compensation packages that can be comprised of competitive salary, bonus, and equity components, along with the opportunity to earn further financial bonuses and rewards.

Googlers thrive in small, focused teams and high-energy environments, believe in the ability of technology to change the world, and are as passionate about their lives as they are about their work. For more information, visit careers.google.com.",N/A
Microsoft,10000+ Employees,"Redmond, WA",Computer Hardware & Software,4.4,4.4,4.3,4.1,4.0,4.1,4.1,"See All 29,391 Reviews","Our drive to change the world unites us!

Microsoft is the ideal place for people who have passion for their work and the desire to make an impact—in their careers, in the community and on the world. Microsoft is a unique company; and not just within the tech industry. Here, smart people thrive on their own terms and push their intelligence to its limit. The variety of job opportunities and career advancement at Microsoft is incredible and empowers you to constantly challenge yourself and chart your own course.",N/A
Apple,10000+ Employees,"Cupertino, CA",Computer Hardware & Software,4.3,4.4,4.3,3.7,3.7,4.3,3.8,"See All 20,848 Reviews","We’re a diverse collective of thinkers and doers, continually reimagining what’s possible to help us all do what we love in new ways. The people who work here have reinvented entire industries with the Mac, iPhone, iPad, and Apple Watch, as well as with services, including Apple TV, the App Store, Apple Music, and Apple Pay. And the same innovation that goes into our products also applies to our practices — strengthening our commitment to leave the world better than we found it.

Every new product we invent, service we create, or store we open is the result of people working together to make each other’s ideas stronger. That happens here because every one of us strives toward a common goal — creating the best customer experiences. So bring your passion, courage, and original thinking and get ready to share it. This is where your work can make a difference in people’s lives. Including your own.",N/A
US Air Force,10000+ Employees,"Washington, DC",Federal Agencies,4.2,4.2,4.0,3.3,3.4,4.3,4.2,"See All 16,599 Reviews","The mission of the US Department of the Air Force is to fly, fight, and win -- in air, space, and cyberspace. Along with the Army, Navy, and Marine Corps, the US Air Force is a major military branch of the US Department of Defense responsible for defending the US and its interests through aerial, space, and cyber warfare. The agency includes more than a dozen major commands, including the Air Force Reserve and Air National Guard. It also consists of field operating agencies and direct reporting units, which are typically assigned to specialized missions. It has more than 150,000 civilian employees and 330,000 active duty personnel, some of whom are deployed in Afghanistan, Iraq, and the Asia/Pacific region.",N/A
Cisco Systems,10000+ Employees,"San Jose, CA",Computer Hardware & Software,4.2,4.3,4.3,4.2,3.8,4.1,3.9,"See All 21,804 Reviews","#WeAreCisco, where each person is unique, but we bring our talents to work as a team and make a difference. Here’s how we do it.

We embrace digital, and help our customers implement change in their digital businesses. Some may think we’re “old” (30 years strong!) and only about hardware, but we’re also a software company. And a security company. A blockchain company. An AI/Machine Learning company. We even invented an intuitive network that adapts, predicts, learns and protects. No other company can do what we do – you can’t put us in a box!

But “Digital Transformation” is an empty buzz phrase without a culture that allows for innovation, creativity, and yes, even failure (if you learn from it.)

So, you have colorful hair? Don’t care. Tattoos? Show off your ink. Like polka dots? That’s cool. Pop culture geek? Many of us are. Passion for technology and world changing? Be you, with us!","Mission: Cisco wants you to bring your uniqueness, join teams to solve challenges, and work together to get results. Be you, with us! #WeAreCisco!

Day to day, we focus on the give and take. We give our best, we give our egos a break and we give of ourselves (because giving back is built into our DNA.) We take accountability, we take bold steps, and we take difference to heart. Because without diversity of thought and a commitment to equality for all, there is no moving forward."
Capital One,10000+ Employees,"Mc Lean, VA",Banks & Credit Unions,4.1,4.2,4.1,4.1,3.6,4.2,3.7,"See All 9,223 Reviews","Money influences everyone in some way, shape or form. At Capital One UK, it is our common purpose to ensure this influence is a positive one on our customers' lives.

We are an information based lending company, founded on the belief that technology and information could transform the industry. Still led by our founder with that vision, we are a successful global bank and one of the UK's top credit card providers supporting millions of customers. We continue to transform at pace and work at the forefront to bring the best to our customers and help them succeed.

Our transformation from financial services company to tech-led business makes us a pretty special place to work. We draw on the latest tech to achieve our purpose. We think it’s good to share too – be it collaborating on projects, expertise, insights or opinions. So we value everyone that works for us.

Our team is relaxed, flexible and full of smart, driven people with heart who are working together to develop the next big things.",N/A
Qualcomm,10000+ Employees,"San Diego, CA",Computer Hardware & Software,4.1,3.9,3.8,3.4,3.6,4.1,4.0,"See All 6,803 Reviews","We’re looking for inventive minds to help fuel what’s next in 5G.

Qualcomm is the wireless technology innovator and the company of inventors that unlocked 5G. We’re ushering in an age of rapid acceleration in wireless connectivity that’s transforming entire industries and enriching lives on a global scale. From smartphones to smart homes, mobile PCs to automotive, gaming to XR/VR/AR, and audio to factories of the future, 5G may be the most important technological development of the 21 st century — and Qualcomm is leading the way.

But this is just the beginning. It takes brilliant minds with diverse skills, backgrounds, and cultures to transform 5G’s potential into world-changing technologies and products. This is the Invention Age — and this is where you come in.",N/A
Intel Corporation,10000+ Employees,"Santa Clara, CA",Computer Hardware & Software,4.1,4.4,4.1,4.0,3.5,4.0,3.9,"See All 17,700 Reviews",N/A,N/A
Bank of America,10000+ Employees,"Charlotte, NC",Banks & Credit Unions,4.0,4.3,4.0,3.8,3.5,4.0,3.8,"See All 26,090 Reviews","Bank of America is one of the world's largest financial institutions, serving individuals, small- and middle-market businesses and large corporations with a full range of banking, investing, asset management and other financial and risk management products and services. The company serves approximately 56 million U.S. consumer and small business relationships. It is among the world's leading wealth management companies and is a global leader in corporate and investment banking and trading.",N/A
Accenture,10000+ Employees,"Dublin, Ireland",Consulting,4.0,4.2,3.9,3.4,3.5,3.9,3.9,"See All 73,974 Reviews","Growing customer expectations. Market-Shaping AI. Self-Optimizing systems. The post-digital age shows no signs of slow down, and the need for the new ideas powered by intelligent technologies has never been greater.

A vision for the future can’t be realized without know-how. Accenture partners with our clients drive real innovation – the kind that turns an idea into an industry – helping them transform and grow their organizations. Learn how we work with companies from all industries across the globe to create the New, now.",N/A
