NAME,SIZE,LOCATION_HQ,INDUSTRY,RATING_OVERALL,RATING_DI,RATING_CV,RATING_WL,RATING_SM,RATING_CB,RATING_CO,NUM_REVIEWS,DESCRIPTION,MISSION
Enterprise Products,5001 to 10000 Employees,"Houston, TX",Oil & Gas Services,4.1,4.0,3.8,3.7,3.6,4.3,4.1,See All 275 Reviews,"About Us

Enterprise Products Partners L.P. is one of the largest publicly traded partnerships and a leading North American provider of midstream energy services to producers and consumers of natural gas, NGLs, crude oil, refined products and petrochemicals. Our services include: natural gas gathering, treating, processing, transportation and storage; NGL transportation, fractionation, storage and import and export terminals; crude oil gathering, transportation, storage and terminals; petrochemical and refined products transportation, storage and terminals; and a marine transportation business that operates primarily on the United States inland and Intracoastal Waterway systems. The partnership’s assets include approximately 50,000 miles of pipelines; 260 million barrels of storage capacity for NGLs, crude oil, refined products and petrochemicals; and 14 billion cubic feet of natural gas storage capacity.

Business Growth Strategy

Our Business Strategies Are Designed To:

- Capitalize on expected demand growth, including exports, for natural gas, NGLs, crude oil and petrochemical and refined products;
- Maintain a diversified portfolio of midstream energy assets and expand this asset base through growth capital projects and accretive acquisitions of complementary midstream assets;
- Enhance the stability of our cash flows by investing in pipelines and other fee-based businesses; and
- Share capital costs and risks through business ventures or alliances with strategic partners, including those that provide processing, throughput or feedstock volumes for growth capital projects or the purchase of such projects' end products

Our business strategy involves expansion through growth projects. We expect that these projects will enhance our existing asset base and provide us with additional opportunities in the future.","Mission: Make the most of your talents in a fast-paced environment driven by people who strive for achievement. Enjoy corporate strength, stability, and a rewarding career at a growing industry-leading and diverse operating company with a track record for success. Tap into the professional possibilities of Enterprise Products."
Contra Costa County - California,10000+ Employees,"Martinez, CA",Municipal Governments,4.1,4.0,3.8,3.9,3.3,3.4,3.9,See All 168 Reviews,"The County of Contra Costa provides a full range of services through 25 County Departments divided into service areas such as: Public Protection, General Government, Health and Human Services, Growth Management, Special Districts and Authorities. There are also a number of Affiliated Organizations. The County has a FY 2016/17 budget of $3.3 billion and a General Fund of $1.5 billion, with permanent authorized countywide staff of approximately 9,360.",N/A
Georgia Tech Research Institute,1001 to 5000 Employees,"Atlanta, GA",Research & Development,4.1,4.5,3.9,4.4,3.5,3.6,3.7,See All 322 Reviews,"The Georgia Tech Research Institute (GTRI) is a highly regarded research and development organization solving engineering problems for the federal government and industry sponsors. GTRI is an integral part of the Georgia Institute of Technology, one of the world’s top-ranked research universities.

With more than 2,000 scientists, engineers, support professionals and students, GTRI tackles difficult component and systems engineering problems in electronics, electromagnetics, electro-optics, cybersecurity, information systems, threat systems and more. Our work encompasses elements of electronic warfare, radars, antennas, electro-optics, secure information and communications systems, prototyping, robotics, unmanned and autonomous systems, test and evaluation, modeling and simulation, and human factors engineering.",N/A
American Traveler,1001 to 5000 Employees,"Boca Raton, FL",Staffing & Outsourcing,4.1,4.0,3.9,3.8,4.0,3.9,3.7,See All 177 Reviews,"American Traveler is a healthcare staffing agency that places nurses and allied healthcare professionals on travel assignments at top-ranked hospitals.

As an industry leader, our company has assembled a team of expertly trained and dedicated professionals who place thousands of travelers in short- and long-term assignments nationwide.

Our travel assignments provide opportunities for career advancement and discovering new places. Team up with us and you'll be part of the travel nurse elite!",N/A
Lazard,1001 to 5000 Employees,"New York, NY",Investment Banking & Asset Management,4.1,3.4,3.9,2.7,3.6,4.4,4.1,See All 334 Reviews,"Lazard, one of the world's preeminent financial advisory and asset management firms, operates from more than 40 cities across 25 countries in North America, Europe, Asia, Australia, Central and South America. With origins dating to 1848, the firm provides advice on mergers and acquisitions, strategic matters, restructuring and capital structure, capital raising and corporate finance, as well as asset management services to corporations, partnerships, institutions, governments and individuals.

We value individual differences and operate with a flat management structure in which everyone contributes.

Social Media Disclosure: https://www.lazard.com/social-media-disclosure/",N/A
CrowdStrike,1001 to 5000 Employees,"Sunnyvale, CA",Enterprise Software & Network Solutions,4.1,4.5,4.1,3.9,3.9,4.2,3.9,See All 218 Reviews,"CrowdStrike® Inc. (Nasdaq: CRWD), a global cybersecurity leader, is redefining security for the cloud era with an endpoint protection platform built from the ground up to stop breaches. The CrowdStrike Falcon® platform’s single lightweight-agent architecture leverages cloud-scale artificial intelligence (AI) and offers real-time protection and visibility across the enterprise, preventing attacks on endpoints on or off the network. Powered by the proprietary CrowdStrike Threat Graph®, CrowdStrike Falcon correlates over two trillion endpoint-related events per week in real time from across the globe, fueling one of the world’s most advanced data platforms for security.

With CrowdStrike, customers benefit from better protection, better performance and immediate time-to-value delivered by the cloud-native Falcon platform.

There’s only one thing to remember about CrowdStrike: We stop breaches.

Qualifying organizations can gain full access to Falcon Prevent™ by starting a free trial.

Learn more: https://www.crowdstrike.com/","Mission: At CrowdStrike we’re on a mission - to stop breaches. Our groundbreaking technology, services delivery, and intelligence gathering, together with our innovations in machine learning and behavioral-based detection, allow our customers to not only defend themselves, but do so in a future-proof manner. We’ve earned numerous honors and top rankings for our technology, organization and people – clearly confirming our industry leadership and our special culture driving it."
"First National Bank of Omaha
Part of First National of Nebraska",1001 to 5000 Employees,"Omaha, NE",Investment Banking & Asset Management,4.1,3.6,3.9,3.6,3.4,3.8,3.5,See All 353 Reviews,"First National Bank has a history of doing what's right for our customers and the communities we serve. Founded in 1857, in the spirit of innovation and commitment to customer service, this sixth generation family-owned business has become the largest privately-owned bank holding company in the United States.
With locations in Nebraska, Colorado, Illinois, Iowa, Kansas, South Dakota and Texas, $20 billion in assets and 5,000 employee associates, we haven't lost sight of the foundation on which our success was built. Integrity, Respect, Passion - these are the cornerstones of our Operating Philosophy and represent our commitment to you. At First National Bank, we strive to better serve you and your banking needs - and we are as hopeful and excited about the future of our bank as our founders were.",N/A
AvalonBay Communities,1001 to 5000 Employees,"Arlington, VA",Real Estate,4.1,4.1,4.2,3.8,3.8,3.7,3.8,See All 686 Reviews,"At AvalonBay, we’re driven by a bold purpose: creating a better way to live. We do this by providing distinctive apartment living experiences and contributing to the vitality of local communities. It’s important work, and we all have a role to play in bringing our purpose to life; you can too.<br />We create a better way to live, not just for our residents, but for all those connected to our company: associates, shareholders, even our local neighbors in the places where we operate.","Mission: Our vision is to be the leading apartment company in select U.S. markets by providing distinctive living experiences that customers value.
Our purpose and this vision underpin every decision we make. They drive our commitment to building and maintaining state-of-the-art communities and to expanding our reach in our markets. They’re the reasons we’ve created distinct brands to meet different customer needs. And they inspire us to give our best every day."
Coldwell Banker,5001 to 10000 Employees,"Parsippany, NJ",Real Estate,4.1,4.2,3.9,4.0,3.9,3.3,3.9,"See All 1,641 Reviews","To say the oldest real estate firm in the US was formed during a major shift in the market would be an understatement. Coldwell Banker was founded during a housing crisis following the 1906 San Francisco earthquake. Now a part of international real estate group Realogy Corporation, the firm's franchise members provide residential property brokerage services as well as refinancing and related support services. Upscale arm Coldwell Banker Previews International markets and sells luxury homes and resorts. There are some 3,300 independently owned and operated Coldwell Banker offices in Asia, Canada, Europe, Latin America, and the US.",N/A
Contra Costa County - California,10000+ Employees,"Martinez, CA",Municipal Governments,4.1,4.0,3.8,3.9,3.3,3.4,3.9,See All 168 Reviews,"The County of Contra Costa provides a full range of services through 25 County Departments divided into service areas such as: Public Protection, General Government, Health and Human Services, Growth Management, Special Districts and Authorities. There are also a number of Affiliated Organizations. The County has a FY 2016/17 budget of $3.3 billion and a General Fund of $1.5 billion, with permanent authorized countywide staff of approximately 9,360.",N/A
American Traveler,1001 to 5000 Employees,"Boca Raton, FL",Staffing & Outsourcing,4.1,4.0,3.9,3.8,4.0,3.9,3.7,See All 177 Reviews,"American Traveler is a healthcare staffing agency that places nurses and allied healthcare professionals on travel assignments at top-ranked hospitals.

As an industry leader, our company has assembled a team of expertly trained and dedicated professionals who place thousands of travelers in short- and long-term assignments nationwide.

Our travel assignments provide opportunities for career advancement and discovering new places. Team up with us and you'll be part of the travel nurse elite!",N/A
Houzz,1001 to 5000 Employees,"Palo Alto, CA",Internet,4.1,4.6,4.3,4.3,3.9,3.9,3.8,See All 984 Reviews,"Houzz is the leading platform for home remodeling and design, providing people with everything they need to improve their homes from start to finish. From decorating a small room to building a custom home and everything in between, Houzz connects millions of homeowners, home design enthusiasts and home improvement professionals across the country and around the world. With the largest residential design database in the world and a vibrant community empowered by technology, Houzz is the easiest way for people to find inspiration, get advice, buy products and hire the professionals they need to help turn their ideas into reality.",N/A
"Henley Enterprises
Hiring Surge
Part of Valvoline",1001 to 5000 Employees,"Newton Highlands, MA",Automotive Parts & Accessories Stores,4.1,3.7,4.3,3.6,3.9,4.1,4.1,See All 182 Reviews,"Henley Enterprises is regarded as a premier oil change service provider and consistently ranks among the top performers in the Valvoline Instant Oil Change franchise system. Consistent growth has been a staple for the Henley companies, which formed to operate one of the first franchised Valvoline Instant Oil Change facilities in Somerville, MA in 1989. Now a coast-to-coast operation with over 215 locations, Henley employs more than 2,000 team members in 11 states.",N/A
Vizient,1001 to 5000 Employees,"Irving, TX",Health Care Services & Hospitals,4.1,4.4,4.2,4.0,3.8,3.9,3.9,See All 329 Reviews,"We are the largest member-driven, health care performance improvement company in the country. Backed by network-powered insights in the critical areas of clinical, operational and supply chain performance, Vizient® empowers members to deliver exceptional, cost-effective care at every turn. Together with our members, we are fueling new business models and new approaches to care—all through the power of brilliant connectivity.",N/A
"Numerator
Hiring Surge",1001 to 5000 Employees,"Chicago, IL",Internet,4.1,4.0,4.1,4.1,4.0,3.7,3.9,See All 163 Reviews,"Numerator is a data and tech company bringing speed and scale to market research. Headquartered in Chicago, IL, Numerator has more than 2,000 employees worldwide. The company blends proprietary data with advanced technology to create unique insights for the market research industry that has been slow to change. The majority of Fortune 100 companies are Numerator clients.",N/A
SPS Commerce,1001 to 5000 Employees,"Minneapolis, MN",Computer Hardware & Software,4.1,4.1,4.3,4.0,4.0,3.4,4.2,See All 302 Reviews,"SPS Commerce is the world’s leading retail network, connecting trading partners around the globe to optimize supply chain operations for all retail partners. We support data-driven partnerships with innovative cloud technology, customer-obsessed service and accessible experts so our customers can focus on what they do best. To date, more than 90,000 companies in retail, distribution, grocery and e-commerce have chosen SPS as their retail network. SPS has achieved 78 consecutive quarters of revenue growth and is headquartered in Minneapolis.",N/A
PGA TOUR,1001 to 5000 Employees,"Ponte Vedra Beach, FL",Sports & Recreation,4.1,3.6,3.7,3.6,3.4,3.8,3.2,See All 126 Reviews,"It takes the ferocity of a Tiger to get to the top of this membership organization. The PGA TOUR, which includes Tiger Woods and golf's other top players, puts on more than 100 official events per year that offer more than $350 million in prize money. Its major championships are the Masters, US Open, British Open, and PGA Championship. The group also oversees the Champions Tour, for players 50 and older, and the Nationwide Tour, for emerging players. The PGA TOUR is separate from the PGA of America, which consists mostly of club pros, although most tour players maintain membership in both groups. The PGA TOUR was formed in 1968 by a splinter faction of the PGA of America.","Mission: By showcasing golf's greatest players, we engage, inspire and positively impact our fans, partners and communities worldwide.

OUR DIVERSITY MISSION:

As a global organization, the PGA TOUR aspires to reflect the regions and communities where we play as we believe diversity of thought and background is vital to our success and growth. We strive to create an inclusive and welcoming culture and be a positive example for all of our constituents and partners."
The Federal Savings Bank,1001 to 5000 Employees,"Chicago, IL",Banks & Credit Unions,4.1,4.6,4.0,3.8,4.1,3.9,4.2,See All 227 Reviews,N/A,N/A
2020 Companies,5001 to 10000 Employees,"Fort Worth, TX",Advertising & Marketing,4.1,4.0,4.1,4.1,4.0,4.0,3.9,See All 824 Reviews,"WHO WE ARE
2020 Companies is one of the premier outsourced merchandising and sales & marketing agencies in the United States. Our success over the past 23 years has been a result of our relentless passion to elevate consumers, our team members, and our clients.

WHAT WE DO
Whether we are launching new products, penetrating new consumer segments, or executing sales and marketing strategies, we can help you reach your business goals. 2020 identifies the opportunities in every challenge and works side-by-side with brands to guarantee success.

2020 is built on scalable infrastructure, industry-leading speed to market, and benchmark-breaking results. We have never missed a launch. To meet our clients’ goals and deadlines, we recruit, train, staff, and manage the right team for every project. We tailor our initiatives to meet their goals, and scale the staff to fit the size and deployment timetable they need.",N/A
Sirius Computer Solutions,1001 to 5000 Employees,"San Antonio, TX",IT Services,4.1,4.5,4.0,4.1,3.7,3.8,3.9,See All 256 Reviews,"Sirius is a national integrator of technology-based business solutions that span the enterprise, including the data center and lines of business. Built on products and services from the world’s top technology companies, Sirius solutions are installed, configured and supported by our dedicated teams of highly certified experts.

With the right people and the right partners, Sirius is able to focus on solutions to help IT professionals cut costs, increase reliability, ease the burden of management, maximize flexibility, mitigate risk and improve service.

We require our teams to be certified in multiple disciplines and products, so they can help you get from the high-level architecture of a solution all the way down to the technical configuration and implementation of point-products.

Since its founding in 1980, Sirius has grown to be one of the largest IT solutions integrator in the U.S. Today.",N/A
"First Student
Part of FirstGroup America",10000+ Employees,"Cincinnati, OH",Bus Transportation Services,4.1,3.9,3.8,3.9,3.7,3.7,3.8,"See All 1,381 Reviews","First Student knows that a student's first assignment is to get to school, safely and on time. Together, First Student and sister company FirstCanada transport about five million students to and from their classrooms every day via a fleet of some 44,000 buses. As North America's #1 school bus business, they operate from a network of 500-plus locations, spanning 39 states in the US and seven provinces in Canada. In addition to transportation, the company offers a slew of ancillary services, including preventative maintenance, fuel (its storage and purchase), route optimization, used bus sales, and more. First Student is a subsidiary of FirstGroup America, which is a unit of UK bus and train operator FirstGroup.",N/A
HDR,10000+ Employees,"Omaha, NE",Architectural & Engineering Services,4.1,3.9,3.9,3.7,3.6,3.9,3.8,See All 795 Reviews,"HDR is an employee-owned design firm specializing in engineering, architecture, environmental and construction services. We’re ranked No. 6 among the world’s design firms and we’re the largest healthcare design firm. We’re also proud to be ranked No. 35 on Forbes magazine’s list of America’s Best Large Employers for 2019. Led by the strength of our values and a culture shaped by employee ownership, we network with each other, build on each other’s contributions, and collaborate together to make great things possible.

When you join HDR, we give you license to do the same. We help you take charge of your career, giving you multiple growth opportunities along the way.

So, what are you waiting for? Come grow with us.",N/A
Nu Skin,1001 to 5000 Employees,"Provo, UT",Consumer Products Manufacturing,4.1,4.2,4.1,4.0,3.7,3.9,3.6,See All 392 Reviews,"Global direct selling company, Nu Skin Enterprises, keeps itself busy exfoliating and polishing. It offers 200-plus personal care products, including cleansers, toners, and anti-aging skin care products, through a global network of some 800,000 independent distributors, sales reps, and preferred customers. It also sells cosmetics, fragrances, hair care items, and mouthwash. Nu Skin has its foot in the door in some 50 global markets, including cherished China. Its Pharmanex unit sells LifePak nutritional supplements. Its Big Planet subsidiary offers personal and small-business technology and communications products, as well as Internet and long-distance services. Nu Skin was founded in 1984 by its Chairman Blake Roney. Nu Skin is known for its enviable company culture, consistently receiving positive employee reviews, company reviews, and leadership reviews. Nu Skin employees rank among the happiest in Utah, receiving Best Company to Work For awards in 2009, 2010 and 2014.","Mission: Nu Skin has a distinctively different approach to business. Nu Skin began with an innovative concept of premium quality products and a uniquely compelling global business opportunity. Today, Nu Skin has maintained that business model and is committed to have the best people, product, culture, and opportunity in the direct sales, skin care, and wellness industries."
TC Energy,5001 to 10000 Employees,"Calgary, Canada",Oil & Gas Services,4.1,3.7,3.9,3.9,3.5,4.4,3.8,See All 664 Reviews,"TransCanada is getting back to the basics: gas transmission and power generation. Through TransCanada PipeLines and other subsidiaries, it wholly owns more than 37,000 miles (and partially owns 5,500 miles) of natural gas pipeline; its six pipelines link the Western Sedimentary Basin to markets in six Canadian provinces and 17 US states. The company also owns a major oil pipeline (Keystone) and stakes in several other gas pipelines in the US, Canada, and Mexico. TransCanada has 380 billion cu. ft. of natural gas storage assets. On the power side of its business portfolio it owns, operates, or controls about 20 power plants in Canada and the US, with more than 10,800 MW of power generation capacity.",N/A
Pegasystems,5001 to 10000 Employees,"Cambridge, MA",Enterprise Software & Network Solutions,4.1,4.2,4.2,4.1,3.6,4.1,3.8,"See All 1,225 Reviews","Pegasystems is the leader in cloud software for customer engagement and operational excellence. If you’ve driven a car, used a credit card, called a company for service, opened an account, flown on a plane, submitted a claim, or performed countless other everyday tasks, chances are you’ve interacted with Pega. For the past 30 years, our technology – CRM, digital process automation, robotics, AI, and more – has empowered the world’s leading companies to achieve breakthrough results.",N/A
Library of Congress,1001 to 5000 Employees,"Washington, DC","Museums, Zoos & Amusement Parks",4.1,4.8,3.5,4.0,3.2,3.7,3.3,See All 120 Reviews,"""A room without books is like a body without a soul."" If Cicero was correct, then this book repository's got it all. The Library of Congress is the oldest cultural institution in the US. The institution boasts more than 138 million items, 32 million books, and 650 miles of bookshelves, and it makes all the difference. Established in 1800, it's a multi-tasking marvel -- serving as a legislative library for Congress, the US Copyright Office, a center for scholarship that preserves materials in more than 470 languages, and a bookworm's paradise with more than 20 reading rooms. and the world's largest repository of print material, maps, recorded music, motion pictures, and TV programs.",N/A
Loma Linda University,1001 to 5000 Employees,"Loma Linda, CA",Colleges & Universities,4.1,3.9,3.9,3.7,3.3,3.4,3.3,See All 140 Reviews,"Loma Linda University (LLU) is a Seventh-day Adventist institution that focuses on health sciences. The university offers more than 100 degree (bachelor's, master's, and doctorate) and certificate programs in the fields of allied health, dentistry, medicine, nursing, pharmacy, public health, and science and technology. It has an enrollment of approximately 4,000 students. LLU is an affiliate of the Loma Linda University Adventist Health Sciences Center, where 550 physicians and other health-care professionals provide medical care at the Loma Linda University Medical Center. The school was founded in 1905 and is one of 15 Seventh-day Adventist universities.",N/A
College Nannies+Sitters+Tutors,1001 to 5000 Employees,"Broomfield, CO",Staffing & Outsourcing,4.1,4.5,4.3,4.3,4.2,3.5,3.8,See All 620 Reviews,"College Nannies, Sitters and Tutors is the nation's most complete resource for customized nanny, professional babysitting and tutoring services. With strong and dedicated local ownership, College Nannies, Sitters and Tutors franchises have been Building Stronger Families nationwide since 2001 by providing role models from cradle to college.

Build a stronger resume while you make a difference in a child’s life. College Nannies, Sitters and Tutors is currently accepting applications from responsible, outgoing individuals for a variety of childcare and tutoring positions. We offer flexible scheduling and a wide variety of positions to fit your skills and preferences.",N/A
