NAME,SIZE,LOCATION_HQ,INDUSTRY,RATING_OVERALL,RATING_DI,RATING_CV,RATING_WL,RATING_SM,RATING_CB,RATING_CO,NUM_REVIEWS,DESCRIPTION,MISSION
Bank of America,10000+ Employees,"Charlotte, NC",Banks & Credit Unions,4.0,4.3,4.0,3.8,3.5,4.0,3.8,"See All 26,092 Reviews","Bank of America is one of the world's largest financial institutions, serving individuals, small- and middle-market businesses and large corporations with a full range of banking, investing, asset management and other financial and risk management products and services. The company serves approximately 56 million U.S. consumer and small business relationships. It is among the world's leading wealth management companies and is a global leader in corporate and investment banking and trading.",N/A
Accenture,10000+ Employees,"Dublin, Ireland",Consulting,4.0,4.2,3.9,3.4,3.5,3.9,3.9,"See All 73,986 Reviews","Accenture is a global professional services company with leading capabilities in digital, cloud and security. Combining unmatched experience and specialized skills across more than 40 industries, we offer Strategy and Consulting, Interactive, Technology and Operations services—all powered by the world’s largest network of Advanced Technology and Intelligent Operations centers. Our 500,000 people deliver on the promise of technology and human ingenuity every day, serving clients in more than 120 countries. We embrace the power of change to create value and shared success for our clients, people, shareholders, partners and communities. Visit us at www.accenture.com.",N/A
Analog Devices,10000+ Employees,"Norwood, MA",Electrical & Electronic Manufacturing,4.0,4.0,3.9,3.9,3.4,3.6,3.7,"See All 1,072 Reviews","Analog Devices, Inc. (ADI) is a leading global technology company—designing and manufacturing technical products, solutions, and ecosystems that fully understand the world around us and help make it better. ADI captures data where it is born, at the intersection of the digital and physical worlds, and converts it into intelligence that helps customers solve complex problems faster and with greater impact. ADI fuses together deep domain knowledge, cutting-edge technology, and the most ingenious problem solvers to take on the toughest technical challenges across diverse sectors. From autonomous transport and industrial automation to healthcare and communications, ADI offers high performance integrated circuits, algorithms, software, and systems to better sense, measure, interpret, connect, secure, and power the digital and physical worlds.",N/A
Milliman,1001 to 5000 Employees,"Seattle, WA",Consulting,4.0,4.1,4.2,3.9,3.8,4.0,3.8,See All 419 Reviews,"Milliman is an independent actuarial and consulting firm with consulting practices on employee benefits, investment, healthcare, life insurance and financial services, and property and casualty insurance. The firm also provides data analysis, predictive analytics, and big data services.

With more than 3,800 employees and revenues of US$1.1 billion in 2018, the firm serves the full spectrum of business, governmental, and financial organizations.

Milliman was co-founded by Wendell Milliman and Stuart Robertson in 1947 and is headquartered in Seattle, Washington, with offices in principal cities worldwide, covering markets in North America, Latin America, Europe, Asia and the Pacific, the Middle East, and Africa.

To learn more about your career opportunities at Milliman, visit http://careers.milliman.com.",N/A
Getty Images,1001 to 5000 Employees,"Seattle, WA",Photography,4.0,4.4,4.0,3.9,3.4,3.8,3.4,See All 492 Reviews,"Getty Images is the most trusted and esteemed source of visual content in the world, with over 200 million assets available through its industry-leading sites www.gettyimages.com and www.istock.com. The Getty Images website serves creative, business and media customers in almost 200 countries and is the first place people turn to discover, purchase and share powerful content from the world's best photographers and videographers. Getty Images works with over 200,000 contributors and hundreds of image partners to provide comprehensive coverage of more than 130,000 news, sport and entertainment events, impactful creative imagery to communicate any commercial concept and the world's deepest digital archive of historic photography.",N/A
eMDs,1001 to 5000 Employees,"Austin, TX",Health Care Services & Hospitals,4.0,4.2,4.0,3.8,3.9,3.8,3.9,See All 187 Reviews,"eMDs offers integrated electronic health records, practice management software, revenue cycle management solutions, and credentialing services for physician practices and enterprises. Founded by physicians, the company is an industry leader for usable, connected software that enables physician productivity and a superior clinical experience. eMDs software has received top rankings in physician and industry surveys including those conducted by the American Academy of Family Physicians’ Family Practice Management, AmericanEHR™ Partners, MedScape®, and Black Book®.",N/A
"Hill's Pet Nutrition
Part of Colgate-Palmolive",1001 to 5000 Employees,"Topeka, KS",Consumer Products Manufacturing,4.0,4.0,4.3,4.0,3.7,4.0,3.9,See All 190 Reviews,"Work that matters, fueled by passion for pets!

At Hill’s we have a purpose. Every day around the world, we transform the lives of millions of pet families through pioneering innovation, amazing nutrition, and the best and brightest people.

Hill's&reg; Science Diet&reg;, Prescription Diet&reg; and Ideal Balance&reg; brand pet foods are sold in more than 86 countries, with total annual sales of more than $2 billion.

Follow us: https://www.facebook.com/HillsPet, https://twitter.com/hillspet, https://twitter.com/hillsvet, https://www.pinterest.com/hillspet, https://www.instagram.com/hillspet, https://www.youtube.com/user/OfficialHillsPet",N/A
Maritz,1001 to 5000 Employees,"Fenton, MO",Advertising & Marketing,4.0,3.7,4.0,4.1,3.5,3.1,3.3,See All 572 Reviews,"Maritz is a St. Louis-based billion-dollar privately held company that has been family-owned and operated for over 125 years.

Through our portfolio of B2B companies, we work with nearly 50% of Fortune 100 organizations to drive meaningful results. We increase customer loyalty, employee experience and sales performance through a variety of services and software solutions, encompassing research, incentives, rewards, incentive travel, meetings and events.

Maritz designs our solutions based on the latest behavioral science research. Our solutions help people define and become their best selves. We believe that being people-centered and purpose-driven is key to business success as well.","Mission: Maritz’ vision is to be the best in the business, fun to work with and our clients’ most valuable ally. Our mission is to help clients achieve their full potential through understanding, enabling and motivating their employees, channel partners and customers.

Our vision and mission is rooted in our six values:
• Client Focus: Unwavering focus on client and marketplace needs
• People: Valuing, respecting, and developing people
• Teamwork: Pulling together to achieve common goals
• Perseverance: Never giving up
• Achievement: Accomplishing goals
• Fun: Creating a spirit of fun and good cheer in our everyday activities"
"Virgin America
Acquired by Alaska Airlines",1001 to 5000 Employees,"Burlingame, CA",Airlines,4.0,N/A,4.2,3.6,3.2,3.5,3.4,See All 333 Reviews,"An offspring of Sir Richard Branson's Virgin Group, Virgin America took flight just as high fuel prices and a recession rocked the airline industry. In 2007 the carrier launched service from San Francisco to Los Angeles and New York, and now serves more than a dozen destinations in the US as well as Canada and Mexico with a fleet of 25-plus Airbus A320 jets. It competes as a low-fare carrier, but distinguishes itself from rivals by providing first-class service and myriad in-flight entertainment options. In 2010 Virgin America's ownership shifted; a group of US investors picked up a 75% stake (including an affiliate of Cyrus Capital which holds more than a 55% stake). The remaining 25% is held by Virgin Group.",N/A
Moffitt Cancer Center,5001 to 10000 Employees,"Tampa, FL",Health Care Services & Hospitals,4.0,4.1,4.2,3.8,3.4,3.8,3.7,See All 446 Reviews,"At Moffitt Cancer Center, we come face-to-face with cancer every day, but we also see courage. And it inspires us to be the safest and best place for cancer care – to bring greater hope to every patient we serve. It’s why we’ve been continually named One of the Top Places to Work in the Tampa Bay Area. As the only National Cancer Institute-designated Comprehensive Cancer Center based in Florida, Moffitt employs some of the best and brightest minds from around the world. Moffitt is the top cancer hospital in Florida and the Southesast according to U.S. News & World Report and has been nationally ranked by since 1999. Because working at Moffitt is both a career and a mission: to contribute to the prevention and cure of cancer. Join a dedicated, diverse and inclusive team of over 7,000 to be a part of the Courageous future we envision.",N/A
"Dexcom
Hiring Surge",5001 to 10000 Employees,"San Diego, CA",Biotech & Pharmaceuticals,4.0,3.6,3.9,3.7,3.5,4.0,3.8,See All 661 Reviews,"Dexcom, Inc. empowers people to take control of diabetes through innovative continuous glucose monitoring (CGM) systems. Founded in 1999 and headquartered in San Diego, California, Dexcom has emerged as a leader of diabetes care technology. By listening to the needs of users, caregivers, and providers, Dexcom strives to simplify and improve diabetes management around the world.

CGM systems are medical devices that can show patients’ glucose levels (including the rate of change and direction) throughout the day and night. Dexcom CGM reduces some of the guesswork that comes with making diabetes treatment decisions, offering our users’ greater peace of mind.",N/A
US Army Corps of Engineers,10000+ Employees,"Washington, DC",Federal Agencies,4.0,4.0,4.0,4.1,3.7,4.2,4.0,See All 847 Reviews,"Much of the nation's infrastructure was built on the proverbial back of the US Army Corps of Engineers (USACE). In the 19th and 20th centuries, it built coastal fortifications, improved harbors, eliminated navigation hazards on key rivers, surveyed roads and canals, protected natural resources, constructed buildings and monuments, and explored and mapped much of the western frontier. Today, the USACE is the world's largest public engineering, design, and construction management agency and is involved in research and development, military contingencies, humanitarian assistance, environmental protection, and water resource development. The USACE employs some 34,000 civilians and soldiers.",N/A
JR Automation Technologies,1001 to 5000 Employees,"Holland, MI",Miscellaneous Manufacturing,4.0,3.7,3.6,2.9,3.4,3.5,3.9,See All 104 Reviews,"Thriving on innovation, while building on the solid foundations of experience, JR Automation has grown to become a leading capital equipment designer, integrator, and manufacturer throughout the world.

We design and build solutions that are a part of your overall strategy - machines that have lean thinking hardwired into them at the point of conception. We've built thousands of machines in our 38+ year history and are always looking forward to the next challenging project.

With several recent expansions, JR Automation is growing to meet customer demands and is focused on staying at the forefront of automation technologies.
◾In business since 1980
◾1,900 employees across the world
◾Facilities in 21 locations
◾Annual sales exceeding $570 million
◾ISO 9001:2015 certified since 2017
◾ITAR Certified facility",N/A
College Works Painting,1001 to 5000 Employees,"Irvine, CA",Construction,4.0,4.4,4.3,3.6,4.1,3.6,4.2,See All 833 Reviews,"Our internship gives students a once in a lifetime opportunity to gain management, leadership, and business skills that they can apply to any future job position in any industry while homeowners receive a gratifying house painting experience from ambitious and driven college students.","Mission: The mission of College Works Painting is to provide highly motivated individuals with a premier hands-on leadership development experience in a safe, competitive, profitable, challenging, and fun environment and to grow our customer base, level of support, and customer satisfaction while providing the greatest learning experience available to our team members."
University of Missouri St Louis,1001 to 5000 Employees,"Saint Louis, MO",Colleges & Universities,4.0,4.6,3.8,4.3,3.6,3.5,3.3,See All 129 Reviews,"With nearly 17,000 students, UMSL is the largest public research university in eastern Missouri. It provides excellent learning experiences and leadership opportunities to a diverse student body whose influence on the region upon graduation is immense.

UMSL is spread across 470 acres in suburban St. Louis County. It has a mix of modern and historic academic buildings as well as a variety of student residence halls, condominiums and apartments. It’s the perfect setting for students to gain unique insights from outstanding faculty and work experience from internships at companies and organizations found only in this world-class metropolitan region.

While UMSL graduates can be found in all 50 states and 63 countries, their greatest impact is felt right here in St. Louis. More than 65,000 UMSL alumni call the St. Louis region home. They drive the region’s economy and contribute mightily to its social well-being.","Mission: The University of Missouri-St. Louis provides excellent learning experiences and leadership opportunities for a diverse student body. Outstanding faculty and staff, innovative research, and creative partnerships foster synergies that advance the welfare of our stakeholders and benefit the global society."
Con Edison,10000+ Employees,"New York, NY",Utilities,4.0,4.1,3.7,3.8,3.6,4.0,3.8,See All 783 Reviews,"Consolidated Edison Company of New York (Con Edison of New York) keeps the nightlife pulsing in The Big Apple. The utility, a subsidiary of Consolidated Edison, distributes electricity throughout most of New York City and Westchester County. The company distributes electricity to 3.3 million residential and business customers in New York City; it also delivers natural gas to about 1.1 million customers. The utility also provides steam services in portions of the New York metropolitan area. Con Edison of New York owns and operates more than 133,100 miles of overhead and underground power distribution lines.",N/A
Client Network Services,1001 to 5000 Employees,"McLean, VA",IT Services,4.0,3.9,4.0,3.7,3.7,3.6,3.7,See All 220 Reviews,"CNSI delivers a broad range of health information technology enterprise solutions and customizable products to a diverse base of state and federal agencies. We align, build, and manage innovative, high-quality, cost-effective solutions that help customers achieve their mission, enhance business performance, reduce costs, and improve the health for over 50 million Americans.

Headquartered in the Washington, DC area with locations throughout the U.S. and India, CNSI employs a world-class team of technologists, program managers, and subject matter experts, all of whom have experience with large scale mission-critical information technology implementations.",N/A
"ReachLocal
Part of Gannett",1001 to 5000 Employees,"Woodland Hills, CA",Advertising & Marketing,4.0,4.4,4.0,4.0,3.7,3.9,3.8,See All 853 Reviews,"ReachLocal is a digital marketing company dedicated to helping local businesses, franchises, and national brands grow their business. Through our global technology platform, technology partnerships with companies like Google and Facebook, a decade’s worth of marketing insights, and our team of digital marketing experts, we help our clients get the most out of their marketing.

Our digital marketing solutions serviced by our team of experts help clients build their brand and web presence, drive leads and awareness, manage leads and customers, and see their marketing success.

ReachLocal is headquartered in Woodland Hills, CA, with offices across North America, Europe, Latin America, and Asia-Pacific.",N/A
Client Network Services,1001 to 5000 Employees,"McLean, VA",IT Services,4.0,3.9,4.0,3.7,3.7,3.6,3.7,See All 220 Reviews,"CNSI delivers a broad range of health information technology enterprise solutions and customizable products to a diverse base of state and federal agencies. We align, build, and manage innovative, high-quality, cost-effective solutions that help customers achieve their mission, enhance business performance, reduce costs, and improve the health for over 50 million Americans.

Headquartered in the Washington, DC area with locations throughout the U.S. and India, CNSI employs a world-class team of technologists, program managers, and subject matter experts, all of whom have experience with large scale mission-critical information technology implementations.",N/A
"Sonus Networks
Acquired by Ribbon Communications",1001 to 5000 Employees,"Westford, MA",Telecommunications Manufacturing,4.0,4.7,4.1,4.1,3.9,3.9,4.1,See All 320 Reviews,"Sonus brings the next generation of Cloud-based SIP and 4G/VoLTE solutions to its customers by enabling and securing mission critical traffic for VoIP, video, IM and online collaboration. With Sonus, enterprises can intelligently secure and prioritize real-time communications, while service providers can deliver reliable, secure real-time services for mobile, UC and social applications. Sonus offers an award-winning portfolio of hardware-based and virtualized Session Border Controllers (SBCs), Diameter Signaling Controllers (DSCs), Cloud Exchange Networking Platform, Policy/Routing servers and media/signaling gateways.",N/A
Florida Atlantic University,1001 to 5000 Employees,"Boca Raton, FL",Colleges & Universities,4.0,4.3,3.9,3.9,3.4,3.3,3.5,See All 444 Reviews,"Who gives a hoot? About 27,000 ""owls"" enrolled at Florida Atlantic University (FAU) do. The Southeast Florida university offers more than 140 degree programs in academic fields including architecture, liberal arts, education, nursing, science, and engineering. It has about a half-dozen locations in Boca Raton, Ft. Lauderdale, Port St. Lucie, Dania Beach, Jupiter, Fort Pierce, and Davie. FAU was established in 1964 as an institution solely serving upper-division and graduate students; it allowed its first freshman class 20 years later.",N/A
"National Life Group
Hiring Surge",1001 to 5000 Employees,"Montpelier, VT",Insurance Carriers,4.0,3.6,4.3,4.3,3.7,3.8,3.9,See All 215 Reviews,"National Life is here to bring you peace of mind. We’ve been keeping our promises since 1848. Believe in tomorrow. Do good today.

Learn more at www.nationallife.com

Important Disclosure:
National Life Group® is a trade name of National Life Insurance Company, founded in Montpelier, VT in 1848, Life Insurance Company of the Southwest, Addison, TX, chartered in 1955, and their affiliates. Each company of National Life Group is solely responsible for its own financial condition and contractual obligations. Life Insurance Company of the Southwest is not an authorized insurer in New York and does not conduct insurance business in New York. Equity Services, Inc., Member FINRA/SIPC, is a Broker/Dealer and Registered Investment Adviser. All companies, unless otherwise noted, are affiliated and are located in Montpelier, VT. TC95917(0717)P",N/A
"McCormick & Company
Hiring Surge",10000+ Employees,"Hunt Valley, MD",Food & Beverage Manufacturing,4.0,4.4,4.0,3.6,3.7,4.1,4.0,See All 358 Reviews,"McCormick & Company, Incorporated (NYSE: MKC) is a global leader in flavor and one of the most respected and familiar names in the industry. In business for over 130 years, McCormick manufactures, markets, and distributes spices, seasoning mixes, condiments, and other flavorful products to the entire food industry—retail outlets, food manufacturers, and foodservice businesses. McCormick partners with the top 10 packaged food and beverage companies as well as all top 10 foodservice restaurant chains.

The McCormick name represents a trusted source of flavor in millions of kitchens around the globe—in homes and in restaurants. Partnerships with farmers and suppliers around the world allow us to provide great-tasting, quality spices with year-over-year consistency that you can trust.

Our herbs and spices come from 85 different countries, while our brands reach consumers in more than 150 countries and territories. Our passion for quality is matched only by our commitment to an innovative and energetic company culture. At McCormick, we believe in respect, recognition, inclusion, and collaboration, based on the highest ethical values for our employees.

McCormick is a team of nearly 12,400 employees located around the world—and we’re growing. If you have a passion for flavor—and you’re ready to take a journey—come have a seat at our table.",N/A
Quiksilver,5001 to 10000 Employees,"Huntington Beach, CA","Department, Clothing, & Shoe Stores",4.0,4.8,3.9,3.1,3.0,2.8,3.0,See All 359 Reviews,"Quiksilver Inc., is a diversified company that designs, produces and distributes branded apparel, footwear, accessories and related products. Its products are sold in a range of distribution channels, including surf shops, skate shops, snow shops, its concept stores, other specialty stores.

The Company’s brands; Quiksilver, Roxy and DC are focused on different sports within the outdoor market.

The Quiksilver brand represents the boardriding lifestyle, which includes not only surfing, but also skateboarding and snowboarding. It includes shirts, walkshorts, t-shirts, fleece, pants, jackets, footwear, wetsuits, watches, eyewear and other accessories.

The Roxy brand is for young women and also include girls, with the Teenie Wahine and Roxy Girl brands, and infants. Roxy includes a range of sportswear, swimwear, footwear, backpacks, snowboards and other accessories.

The DC brand specializes in performance skate shoes, snowboard boots, sandals and apparel for both young men and juniors.",N/A
American National Insurance,1001 to 5000 Employees,"Galveston, TX",Insurance Agencies & Brokerages,4.0,4.3,4.0,4.3,3.7,3.7,3.9,See All 446 Reviews,"True to its name, American National Insurance offers agricultural, commercial, and personal property/casualty insurance as well as life insurance, annuities, supplemental health, credit, and other types of insurance throughout the US, Puerto Rico, and other territories. The company's subsidiaries include Garden State Life Insurance, Standard Life and Accident Insurance, and Farm Family Holdings. It markets its life and pension products to small businesses and individuals through brokers and agents. Property/casualty products are distributed through its exclusive agency force as well as career agents. The company's direct-to-consumer division sells life and health products.",N/A
"Peloton Interactive
Hiring Surge",1001 to 5000 Employees,"New York, NY",Internet,4.0,4.3,4.0,3.9,3.7,4.3,3.7,See All 244 Reviews,"Peloton is the largest interactive fitness platform in the world with a loyal community of more than 2.6 million Members. The company pioneered connected, technology-enabled fitness, and the streaming of immersive, instructor-led boutique classes for its Members anytime, anywhere. Peloton makes fitness entertaining, approachable, effective, and convenient, while fostering social connections that encourage its Members to be the best versions of themselves. An innovator at the nexus of fitness, technology, and media, Peloton has reinvented the fitness industry by developing a first-of-its-kind subscription platform that seamlessly combines the best equipment, proprietary networked software, and world-class streaming digital fitness and wellness content, creating a product that its Members love. The brand's immersive content is accessible through the Peloton Bike, Peloton Tread, and Peloton App, which allows access to a full slate of fitness classes across disciplines, on any iOS or Android device, Fire TV, Roku, Chromecast and Android TV. Founded in 2012 and headquartered in New York City, Peloton has a growing number of retail showrooms across the US, UK, Canada and Germany. For more information, visit www.onepeloton.com.",N/A
American National Insurance,1001 to 5000 Employees,"Galveston, TX",Insurance Agencies & Brokerages,4.0,4.3,4.0,4.3,3.7,3.7,3.9,See All 446 Reviews,"True to its name, American National Insurance offers agricultural, commercial, and personal property/casualty insurance as well as life insurance, annuities, supplemental health, credit, and other types of insurance throughout the US, Puerto Rico, and other territories. The company's subsidiaries include Garden State Life Insurance, Standard Life and Accident Insurance, and Farm Family Holdings. It markets its life and pension products to small businesses and individuals through brokers and agents. Property/casualty products are distributed through its exclusive agency force as well as career agents. The company's direct-to-consumer division sells life and health products.",N/A
