NAME,SIZE,LOCATION_HQ,INDUSTRY,RATING_OVERALL,RATING_DI,RATING_CV,RATING_WL,RATING_SM,RATING_CB,RATING_CO,NUM_REVIEWS,DESCRIPTION,MISSION
Lindenwood University,1001 to 5000 Employees,"Saint Charles, MO",Colleges & Universities,3.8,4.1,3.7,4.0,3.4,3.2,3.2,See All 196 Reviews,"Founded in 1827, Lindenwood University is a dynamic four-year institution dedicated to excellence in higher education. We offer approximately 120 undergraduate and graduate degree programs to more than 8,000 students through values-centered programs that lead to development of the whole person in a variety of formats, including traditional, evening, and online. Lindenwood is known nationally and internationally for innovation, entrepreneurship, and extraordinary dedication to students. Lindenwood is accredited by the Higher Learning Commission.

The Lindenwood University System is home to over 1,100 full and part-time faculty and over 600 full and part-time staff employees who are committed to provide providing a quality education and experience for all Lindenwood University system students.",N/A
"Fruit of the Loom, Inc.",10000+ Employees,"Bowling Green, KY",Consumer Products Manufacturing,3.8,4.7,3.8,4.0,3.4,4.1,3.0,See All 235 Reviews,"Fruit of the Loom, Inc., a Berkshire Hathaway company, is an international leader in the design, manufacture and marketing of family apparel, intimates, athletic apparel and sporting equipment. The Company has a robust portfolio of over 20 brands, including iconic heritage brands with over a century of influence, such as Fruit of the Loom®, Russell Athletic®, Spalding®, and Vanity Fair®.

Fruit of the Loom, Inc. is a global holding company headquartered in Bowling Green, Kentucky, which is responsible for the employment of approximately 29,000 people in 26 countries, and the creation of an additional 258,000 jobs through sourcing and licensing manufacturing locations in 37 countries.

For more information on Fruit of the Loom, Inc., please visit www.fotlinc.com

Brands:
www.russellathletic.com
www.vanityfairlingerie.com
www.spalding.com
www.jerzees.com",N/A
Arcadis,1001 to 5000 Employees,"Amsterdam, Netherlands",Construction,3.9,4.1,3.8,3.7,3.4,3.4,3.6,"See All 1,662 Reviews","Arcadis is the leading global Design & Consultancy firm for natural and built assets. Applying our deep market sector insights and collective design, consultancy, engineering, project and management services we work in partnership with our clients to deliver exceptional and sustainable outcomes throughout the lifecycle of their natural and built assets. We are 27,000 people active in over 70 countries. We support UN-Habitat with knowledge and expertise to improve the quality of life in rapidly growing cities around the world. Arcadis. Improving the quality of life.

Arcadis UK now incorporates the Hyder and EC Harris brands.",N/A
Port of Seattle,1001 to 5000 Employees,"Seattle, WA",State & Regional Agencies,3.8,4.2,3.4,3.6,2.9,4.0,3.7,See All 100 Reviews,"The Port of Seattle oversees both an airport (Seattle-Tacoma International, also known as Sea-Tac) and a seaport. The agency's aviation division sees more than 30 million passengers a year. The seaport division serves more than 20 container carriers that import and export containerized and bulk cargo. It also handles calls from some 220 cruise ships. In addition, the seaport division oversees commercial fishing, marinas, and portside commercial properties. Most of the agency's revenue comes from airport operations. The Port of Seattle is run by a five-member commission elected by King County voters. In 2011 the Port marked its centennial year for moving people and cargo in and out of the Pacific Northwest.",N/A
AKQA,1001 to 5000 Employees,"London, United Kingdom",Advertising & Marketing,3.8,4.0,3.9,3.5,3.6,3.4,3.6,See All 770 Reviews,"At AKQA we believe in the imaginative application of art and science to create beautiful ideas, products and services. With an entrepreneurial and collaborative approach, we design adaptive digital services and applications that capture the imagination, delivering impressive returns for our clients.

AKQA is home to 2,200 professionals in 27 studios across the USA, Europe, Middle East, and Australasia.

http://www.akqa.com/",N/A
Genworth,1001 to 5000 Employees,"Richmond, VA",Insurance Carriers,3.8,4.3,3.7,4.0,3.5,4.0,3.3,See All 685 Reviews,"Genworth Financial, Inc. (NYSE: GNW) is a leading Fortune 500® insurance holding company dedicated to helping people secure their financial lives, families and futures. Genworth has leadership positions in products and services that assist consumers in protecting themselves, investing for the future and planning for retirement -- including life insurance, long term care insurance, financial protection coverages, and independent advisor-based wealth management -- and mortgage insurance that helps consumers achieve home ownership while assisting lenders in managing their risk and capital.

Our products and services are offered through financial intermediaries, advisors, independent distributors and sales specialists. Headquartered in Richmond, Virginia, Genworth traces its roots back to 1871 and became a public company in 2004.",N/A
Good Shepherd Services,1001 to 5000 Employees,"New York, NY",Social Assistance,3.8,4.6,4.0,3.5,3.2,2.8,3.8,See All 156 Reviews,"Entrenched in work that was started by the Sisters of the Good Shepherd in New York City in 1857 and incorporated in 1947, Good Shepherd Services in its early years focused on providing residential care to young women who could not live at home.

In partnership with the community, we have built a continuum of neighborhood-based youth development, educational, vocational, and family support services that now includes more than 80 programs—all dedicated to meeting the needs of New Yorkers who live in neighborhoods where inequitable education and scarce resources are pervasive.","Mission: Good Shepherd Services goes where children, youth, and families face the greatest challenges and builds on their strengths to help them gain skills for success. We provide quality, effective services that deepen connections between family members, within schools, and among neighbors. We work closely with community leaders to advocate, both locally and nationally, on behalf of our participants to make New York City a better place to live and work."
Columbia University Medical Center,5001 to 10000 Employees,"New York, NY",Health Care Services & Hospitals,3.8,3.9,3.5,3.6,3.2,3.6,3.5,See All 393 Reviews,"Columbia University Irving Medical Center (CUIMC) is a leader in providing comprehensive patient care and offers a range of general and specialized medical, dental, and nursing services. We have more than 1,800 physicians, surgeons, dentists, and nurses in locations throughout the New York City metro area.

We know each patient is unique. Our knowledge of innovative treatments is enhanced by our compassion for patients and their families and a devotion to maintaining the highest standard of care.",N/A
Ortho Clinical Diagnostics,1001 to 5000 Employees,"Raritan, NJ",Health Care Services & Hospitals,3.8,3.9,3.6,3.5,3.2,3.9,3.3,See All 313 Reviews,"Ortho Clinical Diagnostics is a global leader of in vitro diagnostics serving the global clinical laboratory and immunohematology communities. Across hospitals, hospital networks, blood banks, and labs in more than 120 countries, Ortho’s high-quality products and services enable healthcare professionals to make better-informed treatment decisions. For the immunohematology community, Ortho’s blood typing products help ensure every patient receives blood that is safe, the right type and the right unit. Ortho brings sophisticated testing technologies, automation, information management, and interpretation tools to clinical laboratories around the world to help them run more efficiently, effectively and improve patient care. Ortho’s purpose is to improve and save lives with diagnostics and it does that by reimagining what’s possible. This is what has defined Ortho for more than 75 years, and it’s what drives Ortho forward. For more information, visit www.orthoclinicaldiagnostics.com.","Mission: Our mission is to enable medical professionals to diagnose conditions early and make better-informed treatment decisions. As a valued team member, you will carve your own career path and be part of building this company stronger and better than ever before.

Video overview:
https://www.youtube.com/watch?v=TyH_DJg6GVE"
Perrigo,10000+ Employees,"Dublin, Ireland",Biotech & Pharmaceuticals,3.8,4.1,3.7,3.8,3.4,3.8,3.6,See All 409 Reviews,"Perrigo Company plc, a leading global healthcare company, delivers value to its customers and consumers by providing Quality Affordable Healthcare Products®.

Founded in 1887 as a packager of home remedies, Perrigo has built a unique business model that is best described as the convergence of a fast-moving consumer goods company, a high-quality pharmaceutical manufacturing organization and a world-class supply chain network.

Perrigo is the world's largest manufacturer of over-the-counter (""OTC"") healthcare products and supplier of infant formulas for the store brand market. The Company also is a leading provider of branded OTC products throughout Europe and the U.S., as well as a leading producer of ""extended topical"" prescription drugs.

Perrigo, headquartered in Ireland, sells its products primarily in North America and Europe, as well as in other markets, including Australia, Israel and China.","Mission: Perrigo is committed to providing ""Quality Affordable Healthcare Products®"" products to consumers around the world. We are also dedicated to “doing the right thing” – whether it is the way we manufacture our products, interact with key stakeholders, impact the communities in which we operate, or work together to deliver on our business goals."
J. Paul Getty Trust,1001 to 5000 Employees,"Los Angeles, CA",Grantmaking Foundations,3.8,4.0,3.8,3.5,3.1,3.7,2.8,See All 134 Reviews,"Founded by industrialist J. Paul Getty in 1954, the Getty started as a small museum in Malibu. Today we are the world's largest cultural and philanthropic organization dedicated to the visual arts. Through ambitious projects in Los Angeles and around the world—including conservation work, publications, exhibitions, grant initiatives, and training programs—we work to make a lasting difference in conservation practice, art historical research, and museology and to promote knowledge and appreciation of art among audiences of all ages. These efforts are undertaken through the collaborative and individual work of our constituent programs—the Getty Conservation Institute, the Getty Foundation, the J. Paul Getty Museum, and the Getty Research Institute.",N/A
Alliance HealthCare Services,1001 to 5000 Employees,"Irvine, CA",Health Care Services & Hospitals,3.8,3.1,3.8,3.7,3.6,3.7,3.4,See All 169 Reviews,"Alliance HealthCare Services provides patient care to over a million patients every year in the critical service line areas of Radiology, Oncology and Interventional/Pain Management. To do so, we deploy diagnostic radiology, radiation therapy, and interventional radiology systems in a variety of settings, including within hospitals and clinics, in outpatient centers, and on medical mobile platforms. Driven by a vision to transform global healthcare, our mission moves us forward daily. We provide essential solutions to our global network of partners and exceptional care to every patient.

With more than 2,600 team members committed to providing exceptional patient care and exceeding customer expectations, Alliance provides quality clinical services for over 1,100 hospitals and other healthcare partners in 47 states.","Mission: ESSENTIAL SOLUTIONS. EXCEPTIONAL CARE.

The incredible Team Members of Alliance are on a mission to provide essential solutions to our customers and exceptional care to our patients. Together, we rally around our patients – from diagnosis to treatment of cancer and chronic pain, our patients always come first. Our business model is designed to help our customers deliver a level of patient experience that they might not otherwise be able to provide on their own. A continuous focus on the patient allows us to align with the goals of our customers. It is the people who work at Alliance that make this all possible."
Port of Seattle,1001 to 5000 Employees,"Seattle, WA",State & Regional Agencies,3.8,4.2,3.4,3.6,2.9,4.0,3.7,See All 100 Reviews,"The Port of Seattle oversees both an airport (Seattle-Tacoma International, also known as Sea-Tac) and a seaport. The agency's aviation division sees more than 30 million passengers a year. The seaport division serves more than 20 container carriers that import and export containerized and bulk cargo. It also handles calls from some 220 cruise ships. In addition, the seaport division oversees commercial fishing, marinas, and portside commercial properties. Most of the agency's revenue comes from airport operations. The Port of Seattle is run by a five-member commission elected by King County voters. In 2011 the Port marked its centennial year for moving people and cargo in and out of the Pacific Northwest.",N/A
J. Paul Getty Trust,1001 to 5000 Employees,"Los Angeles, CA",Grantmaking Foundations,3.8,4.0,3.8,3.5,3.1,3.7,2.8,See All 134 Reviews,"Founded by industrialist J. Paul Getty in 1954, the Getty started as a small museum in Malibu. Today we are the world's largest cultural and philanthropic organization dedicated to the visual arts. Through ambitious projects in Los Angeles and around the world—including conservation work, publications, exhibitions, grant initiatives, and training programs—we work to make a lasting difference in conservation practice, art historical research, and museology and to promote knowledge and appreciation of art among audiences of all ages. These efforts are undertaken through the collaborative and individual work of our constituent programs—the Getty Conservation Institute, the Getty Foundation, the J. Paul Getty Museum, and the Getty Research Institute.",N/A
Alliance HealthCare Services,1001 to 5000 Employees,"Irvine, CA",Health Care Services & Hospitals,3.8,3.1,3.8,3.7,3.6,3.7,3.4,See All 169 Reviews,"Alliance HealthCare Services provides patient care to over a million patients every year in the critical service line areas of Radiology, Oncology and Interventional/Pain Management. To do so, we deploy diagnostic radiology, radiation therapy, and interventional radiology systems in a variety of settings, including within hospitals and clinics, in outpatient centers, and on medical mobile platforms. Driven by a vision to transform global healthcare, our mission moves us forward daily. We provide essential solutions to our global network of partners and exceptional care to every patient.

With more than 2,600 team members committed to providing exceptional patient care and exceeding customer expectations, Alliance provides quality clinical services for over 1,100 hospitals and other healthcare partners in 47 states.","Mission: ESSENTIAL SOLUTIONS. EXCEPTIONAL CARE.

The incredible Team Members of Alliance are on a mission to provide essential solutions to our customers and exceptional care to our patients. Together, we rally around our patients – from diagnosis to treatment of cancer and chronic pain, our patients always come first. Our business model is designed to help our customers deliver a level of patient experience that they might not otherwise be able to provide on their own. A continuous focus on the patient allows us to align with the goals of our customers. It is the people who work at Alliance that make this all possible."
Shearman & Sterling,1001 to 5000 Employees,"New York, NY",Legal,3.8,4.0,3.5,3.0,3.6,3.8,3.4,See All 148 Reviews,"The work of Shearman & Sterling started on Wall Street and spread worldwide. Long known for representing major US financial institutions, today Shearman & Sterling has over 900 lawyers across 23 offices, not only in North America but also in the Asia/Pacific region, Europe, the Middle East, and South America. Its practice areas include antitrust, bankruptcy, capital markets, intellectual property, litigation, mergers and acquisitions, project development and finance, and tax. Shearman & Sterling has counted among its clients Bank of China, Citigroup, France Telecom, and WestLB. The firm was founded in 1873 by Thomas Shearman and John Sterling.",N/A
Jackson National Life,1001 to 5000 Employees,"Lansing, MI",Insurance Carriers,3.8,3.9,3.6,3.9,3.4,3.9,3.7,See All 663 Reviews,"Jackson National Life Insurance Company, a subsidiary of UK insurer Prudential plc, offers financial services (fixed, indexed, and variable annuities) and life insurance products through banks, financial planners, regional broker/dealers, and independent agents. The company also provides asset management, mutual fund, and brokerage services. Its subsidiaries include Jackson National Life Distributors (the company's wholesale distribution arm) and National Planning Holdings (broker relationship management), as well as investment consulting and account management units Curian Capital, Jackson National Asset Management, and PPM America.",N/A
Dow Jones,5001 to 10000 Employees,"Monmouth Junction, 061",News Outlet,3.8,3.9,3.9,4.0,3.2,3.4,3.2,See All 857 Reviews,"Dow Jones is a global provider of news and business information, delivering content to consumers and organizations around the world across multiple formats, including print, digital, mobile and live events. Dow Jones has produced unrivaled quality content for more than 130 years and today has one of the world’s largest newsgathering operations globally. It produces leading publications and products including the flagship Wall Street Journal, America’s largest newspaper by paid circulation; Factiva, Barron’s, MarketWatch, Financial News, DJX, Dow Jones Risk & Compliance, Dow Jones Newswires, and Dow Jones VentureSource. Dow Jones is a division of News Corp (NASDAQ: NWS, NWSA; ASX: NWS, NWSLV).",N/A
General Dynamics,10000+ Employees,"Reston, VA",Aerospace & Defense,3.8,3.8,3.5,3.7,3.2,3.8,3.3,See All 592 Reviews,"From Gulfstream business jets and combat vehicles to nuclear-powered submarines and communications systems, people around the world depend on our products and services for their safety and security.

General Dynamics is a global aerospace and defense company, employing more than 105,000 people, with locations in 46 countries. At the heart of our company are our employees. We rely on their intimate knowledge of customer requirements and a unique blend of skill and innovation to develop and produce the best possible products and services.","Mission: Our ethos — Transparency, Honesty, Alignment and Trust — undergirds our culture, our business model and our daily interactions. These values are a constant reminder of who we are and what we do. They drive how we operate our business, govern how we interact with each other and our customers, partners and suppliers, guide the way that we treat our workforce, and determine how we connect with our communities."
Allegis Group,10000+ Employees,"Hanover, MD",Staffing & Outsourcing,3.8,3.8,3.7,3.6,3.2,3.3,3.4,See All 389 Reviews,"Allegis Group is the global leader in talent solutions focused on working harder and caring more than any other provider. We’ll go further to understand the needs of our people – our clients, our candidates and our employees – and to consistently deliver on our promise of an unsurpassed quality experience. That’s the Allegis Group difference, and it’s consistent across every Allegis Group company. With more than $11 billion in annual revenues and over 500 locations across the globe, our network provides businesses with a comprehensive suite of talent solutions — without sacrificing the niche expertise required to ensure a successful partnership. Our specialized group of companies includes: Aerotek; TEKsystems; Aston Carter; Allegis Global Solutions; Major, Lindsey & Africa; Allegis Partners; MarketSource; EASi; The Stamford Group; and GettingHired.","Mission: At Allegis Group, we strive for excellence through serving others. Our mission is to provide organizations with the highest quality talent solutions while also creating significant opportunities for individuals to realize their professional aspirations and achieve personal success.

We are passionate about our core purpose and will always care more than our competition, bringing the highest levels of intensity, commitment, and competitiveness to everything we do."
Perrigo,10000+ Employees,"Dublin, Ireland",Biotech & Pharmaceuticals,3.8,4.1,3.7,3.8,3.4,3.8,3.6,See All 409 Reviews,"Perrigo Company plc, a leading global healthcare company, delivers value to its customers and consumers by providing Quality Affordable Healthcare Products®.

Founded in 1887 as a packager of home remedies, Perrigo has built a unique business model that is best described as the convergence of a fast-moving consumer goods company, a high-quality pharmaceutical manufacturing organization and a world-class supply chain network.

Perrigo is the world's largest manufacturer of over-the-counter (""OTC"") healthcare products and supplier of infant formulas for the store brand market. The Company also is a leading provider of branded OTC products throughout Europe and the U.S., as well as a leading producer of ""extended topical"" prescription drugs.

Perrigo, headquartered in Ireland, sells its products primarily in North America and Europe, as well as in other markets, including Australia, Israel and China.","Mission: Perrigo is committed to providing ""Quality Affordable Healthcare Products®"" products to consumers around the world. We are also dedicated to “doing the right thing” – whether it is the way we manufacture our products, interact with key stakeholders, impact the communities in which we operate, or work together to deliver on our business goals."
J. Paul Getty Trust,1001 to 5000 Employees,"Los Angeles, CA",Grantmaking Foundations,3.8,4.0,3.8,3.5,3.1,3.7,2.8,See All 134 Reviews,"Founded by industrialist J. Paul Getty in 1954, the Getty started as a small museum in Malibu. Today we are the world's largest cultural and philanthropic organization dedicated to the visual arts. Through ambitious projects in Los Angeles and around the world—including conservation work, publications, exhibitions, grant initiatives, and training programs—we work to make a lasting difference in conservation practice, art historical research, and museology and to promote knowledge and appreciation of art among audiences of all ages. These efforts are undertaken through the collaborative and individual work of our constituent programs—the Getty Conservation Institute, the Getty Foundation, the J. Paul Getty Museum, and the Getty Research Institute.",N/A
Alliance HealthCare Services,1001 to 5000 Employees,"Irvine, CA",Health Care Services & Hospitals,3.8,3.1,3.8,3.7,3.6,3.7,3.4,See All 169 Reviews,"Alliance HealthCare Services provides patient care to over a million patients every year in the critical service line areas of Radiology, Oncology and Interventional/Pain Management. To do so, we deploy diagnostic radiology, radiation therapy, and interventional radiology systems in a variety of settings, including within hospitals and clinics, in outpatient centers, and on medical mobile platforms. Driven by a vision to transform global healthcare, our mission moves us forward daily. We provide essential solutions to our global network of partners and exceptional care to every patient.

With more than 2,600 team members committed to providing exceptional patient care and exceeding customer expectations, Alliance provides quality clinical services for over 1,100 hospitals and other healthcare partners in 47 states.","Mission: ESSENTIAL SOLUTIONS. EXCEPTIONAL CARE.

The incredible Team Members of Alliance are on a mission to provide essential solutions to our customers and exceptional care to our patients. Together, we rally around our patients – from diagnosis to treatment of cancer and chronic pain, our patients always come first. Our business model is designed to help our customers deliver a level of patient experience that they might not otherwise be able to provide on their own. A continuous focus on the patient allows us to align with the goals of our customers. It is the people who work at Alliance that make this all possible."
Intelsat,1001 to 5000 Employees,"McLean, VA","Cable, Internet & Telephone Providers",3.8,5.0,3.8,3.6,3.3,3.9,3.5,See All 183 Reviews,"As the foundational architects of satellite technology, Intelsat operates the world’s largest and most advanced satellite fleet and connectivity infrastructure. We apply our unparalleled expertise and global scale to connect people, businesses, and communities, no matter how difficult the challenge. Intelsat is uniquely positioned to help our customers turn possibilities into reality – transformation happens when businesses, governments, and communities use Intelsat’s next-generation global network and managed services to build their connected future. Imagine here, with us, at&nbsp;Intelsat.com.

Intelsat has a bird's-eye view of the global communications industry. The former International Telecommunications Satellite Organization, set up by governments around the world in 1964 and reorganized in 2001 as a private enterprise, provides satellite services over its network of more than 50 geostationary satellites. Its system enables Internet connections, TV broadcasts, cellular telephony, and corporate network services. Intelsat serves telecom carriers, ISPs, broadcasters, and other service providers.",N/A
