NAME,SIZE,LOCATION_HQ,INDUSTRY,RATING_OVERALL,RATING_DI,RATING_CV,RATING_WL,RATING_SM,RATING_CB,RATING_CO,NUM_REVIEWS,DESCRIPTION,MISSION
Torchy's Tacos,1001 to 5000 Employees,"Austin, TX",Casual Restaurants,3.9,4.6,4.1,3.7,3.4,3.3,3.5,See All 199 Reviews,"The Torchy's legacy began in Austin, Texas in 2006 with an idea, a dedicated executive chef and a food trailer to now operating in dozens of locations across multiple states. OUR MISSION: Be Damn Good. OUR VISION:
Serve people the best damn tacos. OUR WHY: Passion. OUR MOTTO: Devil is in the details.",N/A
Loma Linda University Health,10000+ Employees,"Loma Linda, CA",Health Care Services & Hospitals,3.8,3.6,3.8,3.6,3.0,3.3,3.5,See All 440 Reviews,"Loma Linda University Medical Center (LLUMC) operates some of the largest clinical programs in the United States in areas such as neonatal care and outpatient surgery and is recognized as the international leader in infant heart transplantation and proton treatments for cancer. Each year, the institution admits more than 33,000 inpatients and serves roughly half a million outpatients. LLUMC is the only level one regional trauma center for Inyo, Mono, Riverside, and San Bernardino counties.",N/A
F5,5001 to 10000 Employees,"Seattle, WA",Computer Hardware & Software,3.9,4.2,4.0,4.0,3.6,4.2,3.6,"See All 1,002 Reviews","Today, business is about people, applications, and the services they need to work more efficiently. F5, a global company entrusted by more than 16,000 of the world’s largest enterprises and government, develops technology solutions that keep applications running smoothly. F5 products are highly programmable and integrate into any data environment, expanding IT capabilities so that software networking defined (SDN) deployments are seamless and scalable. As our digital world becomes more complex, F5 is there, ready with innovative technology that resolves application performance and security challenges of today’s mobile workforce.

**Phishing alert**
Please note that F5 only contacts candidates through F5 email address (ending with @f5.com) or auto email notification from Yello/Workday (ending with f5.com or @myworkday.com).","Mission: F5 (NASDAQ: FFIV) gives the world’s largest businesses, service providers, governments, and consumer brands the freedom to securely deliver every app, anywhere—with confidence. F5 delivers cloud and security application services that enable organizations to embrace the infrastructure they choose without sacrificing speed and control. For more information, go to f5.com. You can also follow @f5networks on Twitter or visit us on LinkedIn and Facebook for more information about F5, its partners, and technologies.
F5 and NGINX are trademarks and service marks of F5 Networks, Inc., in the U.S. and other countries. All other product and company names herein may be trademarks of their respective owners."
"Oakley
Part of Luxottica",1001 to 5000 Employees,"Foothill Ranch, CA",Consumer Products Manufacturing,3.9,4.1,4.0,3.9,3.4,3.4,2.8,See All 713 Reviews,"Oakley sells so many sunglasses, it goggles the mind. The company makes and sells performance sunglasses and ski goggles for sports and fashion enthusiasts. Oakley is known for its lens technologies, including 3D, and especially for its High-Definition Optics. The brand boasts a retail network of more than 160 Oakley ""O"" and Vaults stores in malls throughout the US, and in Europe, Mexico, and Asia-Pacific region. It also sells its wares online and at Dillard's, Sunglass Hut, sporting goods stores and other specialty retail outlets. Oakley also markets a line of apparel and footwear, as well as backpacks and accessories for sports enthusiasts. Founded in 1975, Oakley is owned by Italian eyewear giant Luxottica.",N/A
St. Dominic's,1001 to 5000 Employees,"Jackson, MS",Health Care Services & Hospitals,4.0,4.5,4.1,3.5,3.3,3.5,3.4,See All 126 Reviews,"Since 1946, when the Dominican Sisters operated the Jackson Infirmary, to St. Dominic's burgeoning reputation as a premier healthcare organization, the human factor has been a vital part of St. Dominic's mission. Our Christian healing ministry goes hand in hand with the latest medical advancements to produce a level of care that addresses the specific needs of each patient, from the physical to the spiritual.","Mission: St. Dominic’s recognizes its basic participation in the mission of the Church, which involves two main ministries: Education and Health Care. Three activities: Communicating a Christian message, Establishing Community and Performing Service express our mission of Christian healing."
"Janie and Jack
Part of Gap Inc.",1001 to 5000 Employees,"San Francisco, CA","Department, Clothing, & Shoe Stores",3.8,4.3,3.7,4.3,3.6,3.4,3.2,See All 111 Reviews,"Iconic. Approachable. Connected. These are some of the ideas that guide our every day at Janie and Jack. We set ourselves apart with outstanding quality and great care to every detail, from our clothing to our customer service to the people we work with. Are you ready to be a part of the Janie and Jack story?",N/A
"Egencia
Part of Expedia Group",1001 to 5000 Employees,"Bellevue, WA",Travel Agencies,3.9,4.3,4.1,4.2,3.2,4.1,3.5,See All 264 Reviews,"Egencia makes every business trip count for travelers and travel managers. The travel management company’s industry-leading technology platform simplifies the process of planning, booking and managing business travel. Relying on timely, data-driven insights from Egencia, businesses stay one step ahead by making choices that align with traveler preference and corporate policy. A dedicated team of travel consultants is ready to assist every step of the way, whenever and wherever needed. Egencia serves small, mid-cap and multi-national companies in more than 65 countries. To connect with Egencia, visit egencia.com or @Egencia. Follow along on our blog (https://www.egencia.com/public/us/category/blog).",N/A
"Nimble Storage
Acquired by Hewlett Packard Enterprise | HPE",1001 to 5000 Employees,"San Jose, CA",Computer Hardware & Software,3.9,N/A,3.8,3.8,3.6,3.9,3.5,See All 177 Reviews,"Nimble Storage is the technology leader in flash storage solutions.

Our Promise Is the Power of One: A Single Storage Architecture and Application Consolidation Platform

Most storage architectures were engineered to deliver just a single functional benefit: high performance or high capacity.

The Nimble Storage Adaptive Flash platform is transforming this land of storage silos. Enterprises can use a single architectural approach to cater dynamically to varying workloads’ needs for performance and capacity, as well as data protection.

Only Nimble offers the Power of One: gain the benefits of consolidation, without compromising the ability to deliver the service levels required for specific workloads.

IT organizations that use the Nimble Storage Adaptive Flash platform can predict, manage, and deliver the storage that is required to optimize applications and workloads across the enterprise.",N/A
Google,10000+ Employees,"Mountain View, CA",Internet,4.5,4.4,4.4,4.3,4.1,4.5,4.3,"See All 18,391 Reviews","Google is not a conventional company, and we don’t intend to become one. True, we share attributes with the world’s most successful organizations – a focus on innovation and smart business practices comes to mind – but even as we continue to grow, we’re committed to retaining a small-company feel. At Google, we know that every employee has something important to say, and that every employee is integral to our success. We provide individually-tailored compensation packages that can be comprised of competitive salary, bonus, and equity components, along with the opportunity to earn further financial bonuses and rewards.

Googlers thrive in small, focused teams and high-energy environments, believe in the ability of technology to change the world, and are as passionate about their lives as they are about their work. For more information, visit careers.google.com.",N/A
Microsoft,10000+ Employees,"Redmond, WA",Computer Hardware & Software,4.4,4.4,4.4,4.1,4.0,4.1,4.1,"See All 29,406 Reviews","Our drive to change the world unites us!

Microsoft is the ideal place for people who have passion for their work and the desire to make an impact—in their careers, in the community and on the world. Microsoft is a unique company; and not just within the tech industry. Here, smart people thrive on their own terms and push their intelligence to its limit. The variety of job opportunities and career advancement at Microsoft is incredible and empowers you to constantly challenge yourself and chart your own course.",N/A
Apple,10000+ Employees,"Cupertino, CA",Computer Hardware & Software,4.3,4.4,4.3,3.7,3.7,4.3,3.8,"See All 20,867 Reviews","We’re a diverse collective of thinkers and doers, continually reimagining what’s possible to help us all do what we love in new ways. The people who work here have reinvented entire industries with the Mac, iPhone, iPad, and Apple Watch, as well as with services, including Apple TV, the App Store, Apple Music, and Apple Pay. And the same innovation that goes into our products also applies to our practices — strengthening our commitment to leave the world better than we found it.

Every new product we invent, service we create, or store we open is the result of people working together to make each other’s ideas stronger. That happens here because every one of us strives toward a common goal — creating the best customer experiences. So bring your passion, courage, and original thinking and get ready to share it. This is where your work can make a difference in people’s lives. Including your own.",N/A
US Air Force,10000+ Employees,"Washington, DC",Federal Agencies,4.2,4.2,4.0,3.3,3.4,4.3,4.2,"See All 16,619 Reviews","The mission of the US Department of the Air Force is to fly, fight, and win -- in air, space, and cyberspace. Along with the Army, Navy, and Marine Corps, the US Air Force is a major military branch of the US Department of Defense responsible for defending the US and its interests through aerial, space, and cyber warfare. The agency includes more than a dozen major commands, including the Air Force Reserve and Air National Guard. It also consists of field operating agencies and direct reporting units, which are typically assigned to specialized missions. It has more than 150,000 civilian employees and 330,000 active duty personnel, some of whom are deployed in Afghanistan, Iraq, and the Asia/Pacific region.",N/A
Cisco Systems,10000+ Employees,"San Jose, CA",Computer Hardware & Software,4.2,4.3,4.3,4.2,3.8,4.1,3.9,"See All 21,829 Reviews","#WeAreCisco, where each person is unique, but we bring our talents to work as a team and make a difference. Here’s how we do it.

We embrace digital, and help our customers implement change in their digital businesses. Some may think we’re “old” (30 years strong!) and only about hardware, but we’re also a software company. And a security company. A blockchain company. An AI/Machine Learning company. We even invented an intuitive network that adapts, predicts, learns and protects. No other company can do what we do – you can’t put us in a box!

But “Digital Transformation” is an empty buzz phrase without a culture that allows for innovation, creativity, and yes, even failure (if you learn from it.)

So, you have colorful hair? Don’t care. Tattoos? Show off your ink. Like polka dots? That’s cool. Pop culture geek? Many of us are. Passion for technology and world changing? Be you, with us!","Mission: Cisco wants you to bring your uniqueness, join teams to solve challenges, and work together to get results. Be you, with us! #WeAreCisco!

Day to day, we focus on the give and take. We give our best, we give our egos a break and we give of ourselves (because giving back is built into our DNA.) We take accountability, we take bold steps, and we take difference to heart. Because without diversity of thought and a commitment to equality for all, there is no moving forward."
Capital One,10000+ Employees,"Mc Lean, VA",Banks & Credit Unions,4.1,4.2,4.1,4.1,3.6,4.2,3.8,"See All 9,234 Reviews","Capital One is where professional achievement meets personal satisfaction. Here, every day is another chance to do meaningful work and disrupt an entire industry in positive ways—while getting the opportunities, support and benefits you need.

Compassionate and curious. Inspirational and energized. That’s #LifeAtCapitalOne. Discover it for yourself today.","Mission: Capital One is an equal opportunity employer committed to diversity and inclusion in the workplace. All qualified applicants will receive consideration for employment without regard to sex, race, color, age, national origin, religion, sexual orientation, gender identity, protected veteran status, disability or other protected status."
Qualcomm,10000+ Employees,"San Diego, CA",Computer Hardware & Software,4.1,3.8,3.8,3.3,3.6,4.1,4.0,"See All 6,813 Reviews","We’re looking for inventive minds to help fuel what’s next in 5G.

Qualcomm is the wireless technology innovator and the company of inventors that unlocked 5G. We’re ushering in an age of rapid acceleration in wireless connectivity that’s transforming entire industries and enriching lives on a global scale. From smartphones to smart homes, mobile PCs to automotive, gaming to XR/VR/AR, and audio to factories of the future, 5G may be the most important technological development of the 21 st century — and Qualcomm is leading the way.

But this is just the beginning. It takes brilliant minds with diverse skills, backgrounds, and cultures to transform 5G’s potential into world-changing technologies and products. This is the Invention Age — and this is where you come in.",N/A
Intel Corporation,10000+ Employees,"Santa Clara, CA",Computer Hardware & Software,4.1,4.4,4.1,4.0,3.5,4.0,3.9,"See All 17,714 Reviews","Intel’s mission is to shape the future of technology to help create a better future for the entire world. By pushing forward in fields like AI, analytics and cloud-to-edge technology, Intel’s work is at the heart of countless innovations. From major breakthroughs like self-driving cars and rebuilding the coral reefs, to things that make everyday life better like blockbuster effects and improved shopping experiences — they’re all powered by Intel technology. With a career at Intel, you have the opportunity to help make the future more wonderful for everyone.

Join us.",N/A
Bank of America,10000+ Employees,"Charlotte, NC",Banks & Credit Unions,4.0,4.3,4.0,3.8,3.6,4.0,3.8,"See All 26,112 Reviews","Bank of America is one of the world's largest financial institutions, serving individuals, small- and middle-market businesses and large corporations with a full range of banking, investing, asset management and other financial and risk management products and services. The company serves approximately 56 million U.S. consumer and small business relationships. It is among the world's leading wealth management companies and is a global leader in corporate and investment banking and trading.",N/A
Accenture,10000+ Employees,"Dublin, Ireland",Consulting,4.0,4.2,3.9,3.4,3.5,3.9,3.9,"See All 74,066 Reviews","Growing customer expectations. Market-Shaping AI. Self-Optimizing systems. The post-digital age shows no signs of slow down, and the need for the new ideas powered by intelligent technologies has never been greater.

A vision for the future can’t be realized without know-how. Accenture partners with our clients drive real innovation – the kind that turns an idea into an industry – helping them transform and grow their organizations. Learn how we work with companies from all industries across the globe to create the New, now.",N/A
"Our Lady of the Lake (Louisiana)
Part of Franciscan Missionaries of Our Lady Health System",1001 to 5000 Employees,"Baton Rouge, LA",Health Care Services & Hospitals,3.9,4.5,4.2,3.8,3.4,3.9,3.8,See All 196 Reviews,"Our Lady of the Lake is part of Louisiana’s largest, most advanced and respected healthcare system- the Franciscan Missionaries of Our Lady Health System.

Our Lady of the Lake is a not-for-profit 800-bed medical center in Baton Rouge, Louisiana with more than 7,300 employees committed to building a healthy community through excellence in patient care and education. With a Regional Medical Center, dedicated Children’s Hospital, and 300-provider Physician Group, Our Lady of the Lake provides comprehensive healthcare services for common to complex conditions. Our Lady of the Lake is a primary teaching site for graduate medical education programs and is recognized in the areas of heart and vascular, trauma and emergency care, stroke, cancer care, minimally-invasive procedures and more. For more information, visit www.ololrmc.com.",N/A
DSM,10000+ Employees,"Heerlen, Netherlands",Chemical Manufacturing,3.9,3.7,3.7,3.6,3.0,3.9,3.1,See All 698 Reviews,"DSM – Bright Science. Brighter Living.

Royal DSM N.V. is a global science-based company active in health, nutrition and materials. By connecting our unique competences in Life Sciences and Materials Sciences DSM is driving economic prosperity, environmental progress and social advances to create sustainable value for all stakeholders. DSM delivers innovative solutions that nourish, protect and improve performance in global markets such as food and dietary supplements, personal care, feed, pharmaceuticals, medical devices, automotive, paints, electrical and electronics, life protection, alternative energy and bio-based materials. DSM’s 22,000 employees deliver annual net sales of around € 9 billion. The company is listed on NYSE Euronext. More information can be found at www.dsm.com.","Mission: DSM's wide diversity of disciplines makes it possible to offer employees a great variety of roles throughout their career. At DSM we stimulate people to determine their own career path and we encourage international careers. We strive to be an Employer of Choice and ensure that our employees are nurtured and given the opportunity to develop their talents. To learn more about DSM’s HR vision and policy, please visit our website at www.dsm.com/careers"
Visiting Angels,10000+ Employees,"Bryn Mawr, PA",Health Care Services & Hospitals,3.9,4.2,4.0,3.9,3.8,3.1,3.5,See All 752 Reviews,"Visiting Angels “Americas Choice in Senior Home Care” is the Nation’s Premier company in Senior Home Care.
With 600 offices Nationwide serving the Senior Community with Aids to Daily Living.

At Visiting Angels, we understand you want top quality senior home care services for your loved one. You are searching for a qualified, professional elder care provider who will treat your family member with compassion, respect and dignity. We can help you find the senior home care provider that meets all your needs. Our senior home care providers are professionals with the training and skills you have been searching for. We’ll help you find a senior home care provider who can care for all your loved one’s health and well-being needs.",N/A
Reed Smith,1001 to 5000 Employees,"Pittsburgh, PA",Legal,3.9,4.4,4.4,3.8,3.8,3.8,3.7,See All 250 Reviews,"Reed Smith has gone global. The firm has about 1,600 lawyers in more than 20 offices in the US, Europe, the Middle East, and the Asia/Pacific region. Although much of the firm's work involves international business transactions, litigation, and regulatory matters, Reed Smith maintains a wide range of practice areas, from bankruptcy and commercial restructuring to intellectual property, life science, and health care offerings. The firm draws clients from numerous industries, including advertising, financial services, pharmaceuticals, and shipping. Reed Smith was founded in 1877.",N/A
Electrolux,10000+ Employees,"Stockholm, Sweden",Consumer Products Manufacturing,3.9,3.7,3.7,3.6,3.3,3.7,3.4,"See All 1,498 Reviews","Electrolux shapes living for the better by reinventing taste, care and wellbeing experiences, making life more enjoyable and sustainable for millions of people. Through our brands, including Electrolux, AEG, Anova, Frigidaire, Westinghouse and Zanussi, we sell more than 60 million household and professional products in more than 150 markets every year.","Mission: We want to make a change for the better by being the best appliance company in the world, making a positive difference in people’s lives and for our planet. We’re ambitious in what we want to achieve. Reducing our carbon footprint by 50% and increasing material efficiency are two important areas where we want to make a difference in the near future. We believe that by working together to find sustainable solutions that benefit everyone, we will continue to make a positive difference every day."
Old Dominion Freight,10000+ Employees,"Thomasville, NC",Trucking,3.9,3.9,3.6,3.2,3.4,4.3,3.5,See All 566 Reviews,"Old Dominion Freight Line, Inc. (NASDAQ: ODFL) is a leading, less-than-truckload (“LTL”), union-free company providing premium service to all its customers. Founded in 1934 Old Dominion Freight Line started out as a single truck running a 94-mile route in Virginia, over the last 80+ years we’ve led the way to become a national LTL freight leader and global transportation company. The values that drove our founder’s decades ago still inspire us today. Whether it’s on the road, on the docks, in the office, or at one of our cook outs or many celebrations, there’s an attitude of sharing, caring and smiling. It’s an attitude our customers and team members value and appreciate too… one that makes us more than just a freight carrier. It makes us a family. A family that helps the world keep promises.",N/A
Rabobank,10000+ Employees,"Utrecht, Netherlands",Banks & Credit Unions,3.9,4.0,3.8,4.1,3.3,3.7,3.4,See All 926 Reviews,"The Rabobank Group is one of the world’s most leading, sound and sustainable financial institutions. With our roots in the Netherlands, the Rabobank Group has grown in recent decades into an international financial services provider that has activities in the field of banking, asset management, leasing, insurance and real estate.",N/A
"Yale New Haven Hospital
Part of Yale New Haven Health System",10000+ Employees,"New Haven, CT",Health Care Services & Hospitals,3.9,3.9,3.4,3.2,3.2,3.7,4.0,See All 313 Reviews,"Yale New Haven Hospital is the destination for patients who need more than ordinary hospitals can provide. As a Magnet-recognized*, tertiary medical center, with over 1,500 beds, we are the 4th largest hospital in the country, with two acute care campuses, and three emergency departments, including a Level I trauma center. We’re ranked among the best hospitals in the US, and as the primary teaching facility for Yale Schools of Medicine and Nursing, we’re nationally recognized for our commitment to teaching and clinical research.

*Yale New Haven Hospital’s York Street campus and associated ambulatory sites are Magnet-designated by the ANCC.","Mission: YNHHS is committed to innovation and excellence in patient care, teaching, research and service to our communities. The mission reflects the purpose and the underlying commitments that have been a hallmark of YNHH and YNHHS.

YNHHS enhances the lives of those we serve by providing access to integrated, high-value, patient-centered care in collaboration with others who share our values."
Deaconess,5001 to 10000 Employees,"Evansville, IN",Health Care Services & Hospitals,4.0,4.1,3.8,3.5,3.3,3.4,3.8,See All 166 Reviews,"While it primarily presides over numerous health care facilities in the southwestern corner of Indiana, Deaconess Health System also serves residents in parts of southeastern Illinois and western Kentucky. The system consists of two general acute care hospitals, as well as specialty hospitals for women's health, mental health, and medical rehabilitation. Its flagship Deaconess Hospital has 365 beds and serves as a regional referral center. Deaconess Health also operates a standalone cancer treatment center, medical group practice Deaconess Clinic, and about 20 outpatient and urgent care clinics. Its Deaconess Health Plans unit is a PPO network that contracts with various health insurers.",N/A
US Department of Commerce,10000+ Employees,"Washington, DC",Federal Agencies,3.9,4.2,3.4,4.0,3.2,3.8,3.3,See All 359 Reviews,"What's up, DOC? At the US Department of Commerce (DOC), the answer to that question could go on for a while. A Cabinet-level department, the DOC is responsible for a variety of key government functions, such as fostering domestic and international trade, promoting economic growth and job creation, issuing patents, and supporting technological development. It oversees a dozen bureaus, including the US Census, NOAA, the EDA, and the US Patent and Trademark Office. Leveraging its bureaus it collects and analyzes economic, US population, and other data and serves as an advisor to the president. The DOC's budget is approximately $7.5 billion. The forerunner of the DOC was established in 1903.",N/A
Allianz,10000+ Employees,"Munich, Germany",Brokerage Services,3.9,4.0,3.8,3.8,3.3,3.5,3.4,"See All 2,881 Reviews","One of the world's biggest insurers, Allianz SE offers a range of insurance products and services -- including life, health, and property/casualty coverage for individuals and businesses -- through some 100 subsidiaries and affiliates operating all over the globe (though its key markets are France, Germany, Italy, and the US). In addition to selling insurance, Allianz provides retail and institutional asset management services through Allianz Global Investors, private equity investment through Allianz Capital Partners, and banking services through Allianz Bank.",N/A
