NAME,SIZE,LOCATION_HQ,INDUSTRY,RATING_OVERALL,RATING_DI,RATING_CV,RATING_WL,RATING_SM,RATING_CB,RATING_CO,NUM_REVIEWS,DESCRIPTION,MISSION
"DHL Global Forwarding, Freight
Part of DHL",10000+ Employees,"Bonn, Germany",Logistics & Supply Chain,3.9,4.0,3.9,3.6,3.5,3.6,3.6,"See All 1,141 Reviews","Freight Forwarding experts since 1815. Our passion is to enable international trade. We simplify our customer operations and maximize their opportunities.

Let's stay connected.

DHL Global Forwarding, Freight is part of Deutsche Post DHL Group with more than 46,000 freight forwarding experts in more than 100 countries around the world. Our air, ocean, and overland freight forwarding services include standardized transport as well as multimodal and sector-specific solutions, together with individualized industrial projects.","Mission: Our Mission: Excellence. Simply delivered.

We accomplish our mission with excellent execution along the three bottom lines in a sustainable way:

Employer of Choice: Motivated and skilled employees deliver exceptional quality.
Provider of Choice: Exceptional quality delights our Customers and leads to loyalty.
Investment of Choice: Customer loyalty leads to profitable growth."
Huntsman Corp,5001 to 10000 Employees,"The Woodlands, TX",Chemical Manufacturing,3.9,3.9,3.7,3.7,3.2,3.8,3.3,See All 397 Reviews,"Transform the world, Transform your life

From the moment you launch your career with us, you’ll be welcomed with open arms for your ideas, your accomplishments, and your potential.

You’ll work with a team of energized and passionate professionals to bring fresh perspectives and create new solutions. We believe all our employees have unique talents that, combined with a learning mindset, will enable us to continue enriching lives through innovation.

At Huntsman, you will have opportunities to make meaningful contributions to interesting projects. We offer challenging experiences that will broaden your skills and abilities. This includes personalized training and development plans, as well as carefully mapped job paths and career progression. We provide transparency around career opportunities and promote internal mobility across departments, divisions, and countries.","Mission: We will operate safe, clean, efficient facilities in an environmentally and socially responsible manner. We will provide a work environment that fosters teamwork, innovation, accountability and open communication. We will place into society assistance for those who suffer, hope for those who may need inspiration and education for those who may feel the challenge but do not have the means."
"VHB
Hiring Surge",1001 to 5000 Employees,"Watertown, MA",Consulting,3.9,3.4,4.0,3.8,3.6,3.6,3.8,See All 131 Reviews,"We are VHB. We’re passionate about making meaningful contributions to the world through the work that we do. We’re proud, yet humbled, to have been doing this for 40 years. We’re a team—1,600+ strong—eager to deliver value by embracing our clients’ goals, anticipating challenges, building lasting partnerships, and always providing a smooth ride.

Our passionate professionals include engineers, scientists, planners, and designers who partner with clients in the transportation, real estate, institutional, and energy industries, as well as federal, state, and local governments.",N/A
Drexel University,1001 to 5000 Employees,"Philadelphia, PA",Colleges & Universities,3.9,3.7,3.8,4.0,3.5,3.5,3.7,See All 749 Reviews,"These dragons don't need slaying, just a good education. Drexel University (home of the Drexel Dragons) is a private, coeducational institution of higher learning with an enrollment of approximately 20,000 undergraduate and graduate students and a student-teacher ratio of about 17:1. It operates more than a dozen schools and colleges in the US; the Drexel University College of Medicine is the one of the country's largest private medical schools. Drexel runs a mandatory co-operative education program that helps students gain real-world experience while supplying local employers with trained workers. Internships are also available in Europe, Asia, and South America.",N/A
Tyler Technologies,5001 to 10000 Employees,"Plano, TX",Computer Hardware & Software,3.9,3.9,3.8,3.8,3.5,3.4,3.6,See All 589 Reviews,"Tyler Technologies (NYSE: TYL) provides integrated software and technology services to the public sector. Tyler's end-to-end solutions empower local, state, and federal government entities to operate more efficiently and connect more transparently with their constituents and with each other. By connecting data and processes across disparate systems, Tyler's solutions are transforming how clients gain actionable insights that solve problems in their communities. Tyler has more than 27,000 successful installations across more than 11,000 sites, with clients in all 50 states, Canada, the Caribbean, Australia, and other international locations. Tyler has been named to Government Technology’s GovTech 100 list five times and has been recognized three times on Forbes’ ""Most Innovative Growth Companies"" list. More information about Tyler Technologies, an S&P 500 company headquartered in Plano, Texas, can be found at tylertech.com.",N/A
Carnival,10000+ Employees,"Doral, FL",Cruise Ships,3.9,4.0,3.8,3.4,3.4,3.7,3.5,"See All 1,166 Reviews","Carnival offers a boatload of fun. The company is the world's #1 cruise operator, boasting about a dozen cruise lines and about 100 ships with a total passenger capacity of more than 190,000. Carnival operates in North America primarily through its Princess Cruise Line, Holland America, and Seabourn luxury cruise brand, as well as its flagship Carnival Cruise Lines unit. Brands such as AIDA, P&O Cruises, and Costa Cruises offer services to passengers in Europe, and the Cunard Line runs luxury trans-Atlantic liners. Carnival operates as a dual-listed company with UK-based Carnival plc, forming a single enterprise under a unified executive team.",N/A
Floor and Decor,5001 to 10000 Employees,"Atlanta, GA",Home Centers & Hardware Stores,3.9,3.8,3.7,3.6,3.5,3.6,3.9,See All 691 Reviews,"Floor & Decor is a leading specialty retailer of hard surface flooring, offering the broadest in-stock selection of tile, wood, stone, laminate, vinyl and flooring accessories at everyday low prices. The company was founded in 2000 and is headquartered in Atlanta.

At Floor & Decor, homeowners and professional contractors have access to superstore selection at warehouse prices with showroom quality. Our extensive selection of in-stock product allows our customers to get what they need when they need it. And because we source directly from manufacturers or quarries worldwide, our top quality products are priced below those of our competitors.

The Floor & Decor brand is also bolstered by a local focus that allows us to create a store experience and mix of products that meet the needs of each market we serve. We empower our store managers, or chief executive merchants, to create a local shopping experience.

With 100 stores and counting, the opportunities to advance within our organization are endless. We're proud to be recognized as one of Fortune 100's fastest-growing companies in 2020

Visit careers.flooranddecor.com to learn more about available positions and start your career today.","Mission: As a category killer, we will offer a dominant in-stock, locally assorted selection of high-quality hard surface flooring & related accessories, all at the lowest price in the markets we serve. We will serve our associates & customers by executing the P’s of Retail at the very highest level. We will serve our customers with excellent service, a safe shopping environment, inspirational displays, & a compelling shopping experience. We will serve our shareholders by continually driving increased value by leading the industry."
"Esurance
Now known as Allstate",1001 to 5000 Employees,"San Francisco, CA",Insurance Carriers,3.7,5.0,3.8,3.6,3.5,3.4,3.5,See All 724 Reviews,N/A,N/A
NRG Energy,5001 to 10000 Employees,"Princeton, NJ",Energy,3.9,4.6,3.7,3.9,3.7,4.0,3.8,See All 577 Reviews,"NRG is one of the leading integrated power companies in the U.S, powered by people and built on dynamic retail brands with diverse generation resources. A Fortune 500 company, NRG creates value through best-in-class operations, reliable and efficient electric generation, and a retail platform serving residential and commercial businesses. Working with electricity customers, large and small, we continually innovate, embrace and implement sustainable solutions for producing and managing energy.

We aim to be pioneers in developing smarter energy choices and delivering exceptional service as our retail electricity providers serve over 3.7 million residential and commercial customers through the country. In addition, we actively contribute to the local communities where NRG employees live and work. Since 2004, our positiveNRG program has provided millions of dollars to organizations and charities that have a direct impact on the lives of the people in our communities, including food banks and those that foster self-sufficiency, improve housing and provide supplemental education to people in need. NRG has also organized special responses for victims of extreme catastrophe, such as the Haitian earthquake and the Japanese tsunami in 2010 and most recently Houston Hurricane Harvey relief in 2017.

Learn more about NRG: https://youtu.be/AI3-lFyEvCA

Connect with NRG on LinkedIn, Facebook, Twitter or Instagram @nrgenergy.",N/A
Hachette Book Group,1001 to 5000 Employees,"New York, NY",Publishing,3.9,3.1,3.4,3.6,2.9,3.0,3.0,See All 218 Reviews,"Hachette Book Group (HBG) is a leading U.S. trade publisher and a division of the third largest trade and educational book publisher in the world, Hachette Livre. HBG publishes great books for readers of all ages, more than 1,800 new books annually, in all formats—print, ebook, and audiobook—including many New York Times bestsellers. HBG is a dynamic place to work, a fast-paced and fun environment where new ideas in publishing are actively explored and encouraged.","Mission: Our mission is to publish great books well.

Our vision is:
-To be the #1 destination for authors, agents, customers, client publishers, and employees
-To be a respected publisher that values diversity, rewards success, and honors its responsibilities
-To be market focused in all we do, and to lead change in popular culture
-To anticipate change, foster creativity, and encourage risk-taking and innovation"
SDL,1001 to 5000 Employees,"Maidenhead, United Kingdom",Enterprise Software & Network Solutions,3.9,5.0,3.9,3.8,3.6,3.8,3.4,See All 842 Reviews,"SDL (LSE: SDL) is the global leader in content creation, translation and delivery. For over 25 years we’ve helped companies communicate with confidence and deliver transformative business results by enabling powerful experiences that engage customers across multiple touchpoints worldwide. Are you in the know? Find out why 91 of the top 100 global companies work with and trust us on SDL.com. Follow us on Twitter, LinkedIn and Facebook.

Copyright © 2018 SDL plc. All Rights Reserved. The SDL name and logo, and SDL product and service names are trademarks of SDL plc and/or its subsidiaries, some of which may be registered. Other company, product or service names are the property of their respective holders","Mission: Over last 25 years, we have successfully achieved growth by delivering service excellence with technology innovation. Looking forward to the next 25 years, we will continue to build on our foundation and expand market share in our key verticals by offering premium solutions that deliver more value to our investors by decreasing costs through operational efficiencies."
St. Luke's Health System,10000+ Employees,"Boise, ID",Health Care Services & Hospitals,3.9,3.7,3.4,3.4,3.1,3.4,3.4,See All 426 Reviews,"St. Luke’s Health System was founded as a six-bed frontier hospital in 1902 and has evolved to become Idaho’s largest health care provider. St. Luke’s is the only locally governed, Idaho-based, not-for-profit health system, with a network of seven full-service medical centers and more than 160 outpatient centers and clinics serving people throughout Idaho, and eastern Oregon.

The most valuable thing we have is our health. And the most valuable thing St. Luke's can do is help you live as healthy a life as possible. We're taking care forward as we develop new ways—and refine the tried and true—to improve health, improve care, and lower costs.",N/A
Nine West,5001 to 10000 Employees,"West Harrison, NY",Consumer Products Manufacturing,3.7,2.2,3.3,3.6,2.9,3.3,3.2,See All 453 Reviews,"Nine West Group has put its footprints all over the shoe industry. A top designer and marketer of fashionable women's shoes, the group sells footwear (casual, career, and dress), apparel (dresses, suits, denim), and accessories, through more than 500 Nine West and Easy Spirit specialty and outlet stores in the US and Canada. It also distributes its footwear and accessories, including sunglasses, through department, specialty, and independent shoe stores, as well as online. Manufacturers in Brazil, China, and Italy make the company's shoes and boots. Nine West, named for its founding address at 9 West 57th Street in New York, is a subsidiary of The Jones Group (formerly Jones Apparel Group).",N/A
"Secureworks
Part of Dell Technologies",1001 to 5000 Employees,"Atlanta, GA",IT Services,3.9,3.8,3.7,3.9,3.3,3.8,3.6,See All 342 Reviews,"Secureworks® (NASDAQ: SCWX), a global cybersecurity leader, enables customers and partners to outpace and outmaneuver adversaries with more precision, so they can rapidly adapt and respond to market forces to meet their business needs. With a unique combination of cloud-native, SaaS security platform and intelligence-driven security solutions, informed by 20 years of threat intelligence and research, no other security platform is grounded and informed with this much real-world experience.",N/A
USI Insurance Services,5001 to 10000 Employees,"Valhalla, NY",Insurance Agencies & Brokerages,3.9,4.1,4.0,3.8,3.7,3.9,3.7,See All 686 Reviews,"USI is one of the largest insurance brokerage and consulting firms in the world, delivering property and casualty, employee benefits, personal risk, program and retirement solutions to large risk management clients, middle market companies, smaller firms and individuals. USI connects together over 8,000 industry-leading professionals from approximately 200 offices to serve clients’ local, national and international needs. USI has become a premier insurance brokerage and consulting firm by leveraging the USI ONE Advantage®, an interactive platform that integrates proprietary and innovative client solutions, networked local resources and expertise, and enterprise-wide collaboration to deliver customized results with positive, bottom line impact. USI attracts best-in-class industry talent with a long history of deep and continuing investment in our local communities.",N/A
"Dematic
Hiring Surge",10000+ Employees,"Atlanta, GA",Logistics & Supply Chain,3.9,3.9,3.8,3.6,3.3,3.7,3.6,See All 336 Reviews,"Dematic is an intralogistics innovator that designs, builds and supports intelligent, automated solutions for manufacturing, warehouse and distribution environments for customers that are powering the future of commerce. With engineering centers, manufacturing facilities and service centers located in more than 25 countries, the Dematic global network of 10,000 employees has helped achieve more than 6,000 worldwide customer installations for some of the world’s leading brands.

Headquartered in Atlanta, Dematic is a member of KION Group, one of the global leaders in industrial trucks and supply chain solutions, and a leading provider of warehouse automation.",N/A
Motion Industries,5001 to 10000 Employees,"Birmingham, AL",Wholesale,3.8,3.6,3.4,3.4,3.1,3.7,3.5,See All 182 Reviews,"Power transmission products may not be on anyone's Christmas list, but Santa's workshop couldn't groove without the parts that Motion Industries sells. A subsidiary of Genuine Parts, the company drives Genuine's industrial parts business segment. Motion Industries distributes a slew of bearings, hoses, material handling, and linear motion products. The short list of offerings includes electrical (motors and drives) and mechanical (belts, clutches, and chains), as well as fluid (pneumatic and hydraulic) power transmission replacement parts, supplied by big brands like Bosch Rexroth, Eaton, NSK, and Timken. Motion Industries serves its customers through about 500 locations across North America.",N/A
Nasdaq,1001 to 5000 Employees,"New York, NY",Stock Exchanges,3.9,4.3,3.9,3.6,3.8,3.8,3.7,See All 657 Reviews,"Nasdaq (Nasdaq: NDAQ) is a leading provider of trading, exchange technology, information and public company services across six continents. Through its diverse portfolio of solutions, Nasdaq enables customers to plan, optimize and execute their business vision with confidence, using proven technologies that provide transparency and insight for navigating today’s global capital markets. As the creator of the world’s first electronic stock market, its technology powers more than 70 marketplaces in 50 countries, and 1 in 10 of the world's securities transactions. Nasdaq is home to more than 3,500 listed companies with a market value of over $8.8 trillion and more than 10,000 corporate clients. To learn more, visit www.nasdaq.com/ambition or business.nasdaq.com.",N/A
Bank OZK,1001 to 5000 Employees,"Little Rock, AR",Banks & Credit Unions,4.0,4.1,4.2,4.1,4.0,3.7,3.8,See All 229 Reviews,"At Bank OZK, we have a history of hiring the best people - it's the reason we're one of the fastest-growing, most progressive banks. Knowledge and experience are respected, and managers are given authority to make decisions locally. We place equal importance on banking excellence and outstanding customer service. We're looking for qualified people willing to go the extra distance to provide the best banking experience possible to our customers.","Mission: 1. Provide Exceptional Customer Experiences: without our customer we are nothing
2. Teamwork Rocks: none of us can do much alone, but together we are a potent force
3. Do Right: there is no substitute for good behavior, and no excuse for anything less
4. Pursue Excellence: we are going to be something, so let’s make it something great"
Bentley Systems,1001 to 5000 Employees,"Exton, PA",Computer Hardware & Software,3.9,4.2,4.0,4.4,3.5,3.5,3.7,See All 761 Reviews,"At its core, Bentley Systems is a software development company that supports the professional needs of those responsible for creating and managing the world’s infrastructure, including roadways, bridges, airports, skyscrapers, and industrial and power plants, as well as utility networks. Bentley delivers solutions for the entire lifecycle of the infrastructure asset, tailored to the needs of the various professions – the engineers, architects, geospatial professionals, planners, contractors, fabricators, IT managers, operators and maintenance engineers – who will work on and work with that asset over its lifetime. Comprised of integrated applications and services built on an open platform, each solution is designed to ensure that information flows between workflow processes and project team members to enable interoperability and collaboration.",N/A
NRG Energy,5001 to 10000 Employees,"Princeton, NJ",Energy,3.9,4.6,3.7,3.9,3.7,4.0,3.8,See All 577 Reviews,"NRG is one of the leading integrated power companies in the U.S, powered by people and built on dynamic retail brands with diverse generation resources. A Fortune 500 company, NRG creates value through best-in-class operations, reliable and efficient electric generation, and a retail platform serving residential and commercial businesses. Working with electricity customers, large and small, we continually innovate, embrace and implement sustainable solutions for producing and managing energy.

We aim to be pioneers in developing smarter energy choices and delivering exceptional service as our retail electricity providers serve over 3.7 million residential and commercial customers through the country. In addition, we actively contribute to the local communities where NRG employees live and work. Since 2004, our positiveNRG program has provided millions of dollars to organizations and charities that have a direct impact on the lives of the people in our communities, including food banks and those that foster self-sufficiency, improve housing and provide supplemental education to people in need. NRG has also organized special responses for victims of extreme catastrophe, such as the Haitian earthquake and the Japanese tsunami in 2010 and most recently Houston Hurricane Harvey relief in 2017.

Learn more about NRG: https://youtu.be/AI3-lFyEvCA

Connect with NRG on LinkedIn, Facebook, Twitter or Instagram @nrgenergy.",N/A
Mead Johnson,5001 to 10000 Employees,"Glenview, IL",Consumer Products Manufacturing,4.0,4.9,3.6,3.7,3.2,3.6,3.6,See All 314 Reviews,"For more than a century, Mead Johnson Nutrition has led the way in developing products designed to help meet the nutritional needs of infants and children. Today, that passion remains our primary pursuit.

Headquartered in Chicago, Illinois, MJN is the only global company focused primarily on pediatric nutrition. We operate in a growing and vital industry, bringing to market a broad portfolio of leading brands and more than 70 products, from infant formulas to growing-up milks.

Our team members – operating in more than 50 countries – adhere to a set of values that includes the passionate pursuit of continuous improvement; an uncompromising commitment to scientific rigor and quality; maintaining integrity in every relationship we create; and establishing an environment of openness, respect and high performance.

We are over 100 years old. Yet with every birth that takes place, our company – and the potential need for our products – begins anew.",N/A
"Ticketmaster
Part of Live Nation Entertainment",1001 to 5000 Employees,"Los Angeles, CA",Ticket Sales,3.9,4.1,4.0,4.0,3.5,3.8,3.6,See All 801 Reviews,"Ticketmaster is the world’s largest ticket marketplace and the global market leader in live event ticketing products and services. Through official partnerships with thousands of venues, artists, sports teams, festivals, performing arts centers and theaters, Ticketmaster now processes over 500 million tickets per year across 29 different countries.

Why work at Ticketmaster? Here’s a few of the many benefits of our work culture:
• Career development – we prioritize professional growth and extensive training
• Social culture – we love live entertainment because we’re fans too!
• Impact and scale – over 60 million unique fans utilize our platform every single month

No matter the role at Ticketmaster, you're helping fans have the time of their lives – while you do too!","Mission: Our people are our number one asset & one of our most important investments. The pace here is fast, the atmosphere is fun and a passion for live events ties us all together. As a global & growing business, we offer a world of opportunities to expand your skills and develop your career. Here you'll find a diverse mix of passionate employees, helping fans around the globe connect with the artists, teams & live events they love. Because live only happens once."
DLA Piper,5001 to 10000 Employees,"New York, NY",Legal,3.9,3.6,3.7,3.2,3.3,3.8,3.4,See All 537 Reviews,"DLA Piper is one of the largest business law firms in the world and one of the most recognized law firm brands globally. We are an innovative and entrepreneurial firm, deeply committed to our values: our people, our clients and our community. In fact, it is the individual members of the DLA Piper team – the combination of talented lawyers and business professionals working together – who define our success and drive our growth.",N/A
Danone,10000+ Employees,"Paris, France",Food & Beverage Manufacturing,3.9,3.9,4.0,3.3,3.2,3.6,3.5,"See All 2,406 Reviews","Danone is an international company present on all continents. The group holds top positions in healthy food through four businesses: Fresh Dairy Products, Early Life Nutrition, Waters, and Medical Nutrition. Its mission is to bring health through food to as many people as possible.

Danone has over 190 production plants and around 104,000 employees. Present in over 130 markets, Danone generated sales of €22.4 billion in 2015, with more than half in emerging countries. Danone’s brand portfolio includes international brands (Activia, Actimel, Danette, Danonino, evian, Nutrilon/Aptamil, Nutricia) and local brands (Oikos, Prostokvashino, AQUA, Bledina). Listed on Euronext Paris, Danone is a component stock of leading social responsibility indexes including the Dow Jones Sustainability Indexes.

This is in keeping with a business model that aims to create value shared among all stakeholders—not only shareholders, but also employees, business partners, public authorities and local communities.",N/A
Helmerich & Payne,5001 to 10000 Employees,"Tulsa, OK",Oil & Gas Services,3.9,3.1,3.7,3.7,3.4,3.8,3.6,See All 208 Reviews,N/A,N/A
