NAME,SIZE,LOCATION_HQ,INDUSTRY,RATING_OVERALL,RATING_DI,RATING_CV,RATING_WL,RATING_SM,RATING_CB,RATING_CO,NUM_REVIEWS,DESCRIPTION,MISSION
TBC,5001 to 10000 Employees,"Palm Beach Gardens, FL",Automotive Parts & Accessories Stores,4.1,4.5,4.1,4.2,4.1,4.1,4.1,See All 277 Reviews,"TBC Corporation is a leader in the tire and auto-services aftermarket with a corporate portfolio of more than a dozen brands. For more than 60 years, we have offered our customers the highest-quality tires and expert automotive services.

Our company-owned Retail brands include NTB® and Tire Kingdom®. Our Franchise brands includes Midas® and Big O Tires®. And, we are home to NTW, Tire America, TBC Brands, TBC de Mexico, TBC International, Fleet America and R.O. Writer.",N/A
Public Health Trust,10000+ Employees,"Miami, FL",Health Care Services & Hospitals,4.1,4.5,4.2,4.2,3.9,4.7,3.9,See All 15 Reviews,"The Public Health Trust of Miami-Dade County looks out for the sun-baked citizens of South Florida. The trust operates the Jackson Health System (JHS), which is comprised of its flagship facility Jackson Memorial Hospital, Holtz Children's Hospital, a rehabilitation hospital, a mental health hospital, two community hospitals, four primary care centers, about 15 school-based clinics, two long-term care nursing facilities, and an outpatient diagnostic center. Jackson Memorial Hospital has roughly 1,500 beds and offers a wide variety of services, including burn treatment, trauma, pediatrics, rehabilitation, obstetrics, and transplants. It is also a teaching facility for the University of Miami School of Medicine.",N/A
The Fountain Group,1001 to 5000 Employees,"Tampa, FL",Staffing & Outsourcing,4.1,4.7,4.3,4.2,4.1,3.4,3.8,See All 188 Reviews,"The Fountain Group is a staffing firm providing contingent workforce solutions for a wide array of industries. The Fountain Group has been identifying and matching top talent with Fortune 100 – Fortune 500 companies throughout the United States since 2001, and has received numerous awards throughout the nation for our success within the MSP space.

As a partner to these companies, we are committed to providing top industry talent and offering our consultants with rewarding flexible opportunities that create a true work-life balance. At The Fountain Group, we understand that each of our client partners, internal associates and consultants are unique. With this in mind, we’ve structured our talent acquisition team by specialty, allowing us to better understand each unique need and rapidly deliver experienced talent to our valued clients.",N/A
"L&T Technology Services
Part of Larsen & Toubro",10000+ Employees,"Vadodara, India",IT Services,4.1,3.4,4.0,3.7,3.7,3.5,4.0,"See All 2,970 Reviews","L&T Technology Services is a wholly owned subsidiary of Larsen & Toubro, a USD 14 billion - Indian multinational engineering, technology, manufacturing and construction conglomerate.
We are backed by 75 years of engineering excellence of our parent company. We are the Global Delivery Partners for engineering services With deep capability across Complete Engineering Lifecycle Listed 9th among the world's Most Innovative Companies by Forbes Ranked 4th by Newsweek in the list of Greenest Industrial Companies

Service Offerings

Our end-to-end service offerings include product design, analysis, prototyping & testing, embedded system design, manufacturing engineering, plant & construction engineering, asset information management and engineering process support using cutting-edge CAD / CAM / CAE technology in various domains.
Global footprint in US, Europe and Asia, including designated consultant in each of these geographies.","Mission: Our Vision:

To Be Amongst The Top 10 Global Engineering Services Companies,
Recognized for Delivery Excellence and Technology Leadership

A company, that
Offers Solutions Across ‘Design to Shop Floor’
Assists Clients in Improving Their Competitiveness and Top Line
Delivers Sustainable Solutions"
Ingram Content Group,1001 to 5000 Employees,"La Vergne, TN",Publishing,4.1,4.1,4.2,3.9,4.0,4.0,4.1,See All 335 Reviews,"Ingram Content Group is the world’s largest and most trusted distributor of physical and digital content. If you are reading a book, Ingram Content Group is probably behind it. Ingram is the leader in helping content reach its destination anywhere in the world. Whether digital or physical content, Ingram delivers to mobile phones, tablets, online retailers, bookstores, libraries, schools and consumers across the globe. Our company is on the cutting edge of technology in automated manufacturing, digital content distribution and e-learning platforms, and is trusted by publishers, retailers, and libraries for digital and physical solutions. With almost 50 years in the book business, Ingram is a forward-thinking company that got its start as a textbook depository, but has grown and transformed to become the leader in our industry. Ingram is committed to developing technology solutions that make physical and digital books available to readers around the world.",N/A
American Girl,1001 to 5000 Employees,"Middleton, WI",Consumer Products Manufacturing,4.1,4.6,4.1,3.9,3.5,3.7,3.1,See All 427 Reviews,"Pleasant Rowland introduced American Girl dolls in 1986 as a historically-themed alternative to Barbie and the Cabbage Patch Kids. Since 1998 her firm has been owned by the maker of both rival dolls, #1 toy manufacturer Mattel. American Girl (formerly Pleasant Company) produces the American Girls Collection of 18-inch, high-dollar dolls, including Addy (an escaped slave) and Rebecca Rubin (a young Jewish immigrant). It also publishes ""American Girl"" magazine and American Girl books (more than 135 million copies sold) and sells room décor, clothing, and accessories, including items that match the dolls. Items are sold through catalogs, its website, at about 10 namesake stores, and an outlet store in Wisconsin.",N/A
Novo Nordisk,10000+ Employees,"Bagsværd, Denmark",Biotech & Pharmaceuticals,4.1,3.8,3.9,4.0,3.4,4.1,3.6,"See All 1,535 Reviews","Novo Nordisk is a global healthcare company with more than 90 years of innovation and leadership in diabetes care. This heritage has given us experience and capabilities that also enable us to help people defeat other serious chronic conditions: hemophilia, growth disorders and obesity.

Headquartered in Denmark, Novo Nordisk employs approximately 42,000 people in 77 countries and markets its products in more than 165 countries.",N/A
Volkswagen,10000+ Employees,"Wolfsburg, Germany",Transportation Equipment Manufacturing,4.1,4.0,3.6,3.7,3.5,3.9,3.5,"See All 2,289 Reviews","With cars named for climate patterns, insects, and small mammals, Volkswagen (VW) leads the Continent as Europe's #1 carmaker. Along with Golf (Gulf Stream reference) and the New Beetle, VW's annual production of more than 7 million cars, trucks, and vans includes such models as Passat (trade wind), Jetta (jet stream), Rabbit, and Fox. VW also owns a garage full of luxury carmakers -- AUDI, Lamborghini, Bentley, and Bugatti. Other brands include SEAT (family cars, Spain) and Skoda (family cars, the Czech Republic). Late in 2009 VW acquired a 49.9% stake in Porsche for about E4 billion (almost $6 billion) as the first step in combining the two into an integrated car company.",N/A
Air Products,10000+ Employees,"Allentown, PA",Chemical Manufacturing,4.1,4.2,3.9,3.5,3.5,3.8,3.6,See All 782 Reviews,"Air Products (NYSE:APD) is a world-leading Industrial Gases company in operation for 80 years. The Company provides industrial gases and related equipment to dozens of industries, including refining, chemical, metals, electronics, manufacturing, and food and beverage. Air Products is also the world’s leading supplier of liquefied natural gas process technology and equipment. The Company develops, engineers, builds, owns and operates some of the world's largest industrial gas projects, including gasification projects that sustainably convert abundant natural resources into syngas for the production of high-value power, fuels and chemicals.

The Company had fiscal 2020 sales of $8.9 billion from operations in 50 countries and has a current market capitalization of about $55 billion. More than 19,000 passionate, talented and committed employees from diverse backgrounds are driven by Air Products’ higher purpose to create innovative solutions that benefit the environment, enhance sustainability and address the challenges facing customers, communities, and the world.",N/A
Sarasota Memorial Hospital,5001 to 10000 Employees,"Sarasota, FL",Health Care Services & Hospitals,4.1,4.4,4.2,4.0,4.0,4.2,4.1,See All 142 Reviews,"Sarasota Memorial Health Care System, an 839-bed regional medical center, is among the largest public health systems in Florida. With more than 6,000 staff, nearly 1,000 physicians and 750 volunteers, it is one of Sarasota County's largest employers. A community hospital founded in 1925, Sarasota Memorial is a full-service health system, with specialized expertise in heart, vascular, cancer, and neuroscience services, as well as a network of outpatient centers, long-term care and rehabilitation among its many programs. Sarasota Memorial is the only hospital providing obstetrical and pediatrics services, a Level III Neonatal Intensive Care Unit (NICU) and Level II Trauma Center in Sarasota County. Sarasota Memorial is proud to have earned four consecutive Magnet Hospital designations (the highest honor in nursing) from the American Nurses Credentialing Center, as well as the Gallup Great Workplace Award, among its many honors.","Mission: Mission
To provide health care services which excel in Caring, Quality and Innovation.

Vision
Our community will be served by the best health care system in America. SMHCS will be the best place to be a patient, the best place to work, and the best place to practice medicine. Our extraordinary people, our innovative clinical technology, and our effective use of information systems will set us apart."
Applied Systems,1001 to 5000 Employees,"University Park, IL",Computer Hardware & Software,4.1,4.4,4.4,4.3,3.9,3.8,3.9,See All 405 Reviews,"Applied Systems is the leading global provider of cloud-based software that powers the business of insurance. Recognized as a pioneer in insurance automation and the innovation leader, Applied is the world’s largest provider of agency and brokerage management systems, serving customers throughout the United States, Canada, the Republic of Ireland, and the United Kingdom. By automating the insurance lifecycle, Applied’s people and products enable millions of people around the world to safeguard and protect what matters most.","Mission: Applied’s mission is to continuously improve the business of insurance. We are recognized as the insurance industry’s trusted technology partner due to our commitment to software innovation and customer success. By powering the global business of insurance, we enable insurance agencies, brokers, carriers and their consumers to safeguard and protect what matters most."
American Girl,1001 to 5000 Employees,"Middleton, WI",Consumer Products Manufacturing,4.1,4.6,4.1,3.9,3.5,3.7,3.1,See All 427 Reviews,"Pleasant Rowland introduced American Girl dolls in 1986 as a historically-themed alternative to Barbie and the Cabbage Patch Kids. Since 1998 her firm has been owned by the maker of both rival dolls, #1 toy manufacturer Mattel. American Girl (formerly Pleasant Company) produces the American Girls Collection of 18-inch, high-dollar dolls, including Addy (an escaped slave) and Rebecca Rubin (a young Jewish immigrant). It also publishes ""American Girl"" magazine and American Girl books (more than 135 million copies sold) and sells room décor, clothing, and accessories, including items that match the dolls. Items are sold through catalogs, its website, at about 10 namesake stores, and an outlet store in Wisconsin.",N/A
Novo Nordisk,10000+ Employees,"Bagsværd, Denmark",Biotech & Pharmaceuticals,4.1,3.8,3.9,4.0,3.4,4.1,3.6,"See All 1,535 Reviews","Novo Nordisk is a global healthcare company with more than 90 years of innovation and leadership in diabetes care. This heritage has given us experience and capabilities that also enable us to help people defeat other serious chronic conditions: hemophilia, growth disorders and obesity.

Headquartered in Denmark, Novo Nordisk employs approximately 42,000 people in 77 countries and markets its products in more than 165 countries.",N/A
Volkswagen,10000+ Employees,"Wolfsburg, Germany",Transportation Equipment Manufacturing,4.1,4.0,3.6,3.7,3.5,3.9,3.5,"See All 2,289 Reviews","With cars named for climate patterns, insects, and small mammals, Volkswagen (VW) leads the Continent as Europe's #1 carmaker. Along with Golf (Gulf Stream reference) and the New Beetle, VW's annual production of more than 7 million cars, trucks, and vans includes such models as Passat (trade wind), Jetta (jet stream), Rabbit, and Fox. VW also owns a garage full of luxury carmakers -- AUDI, Lamborghini, Bentley, and Bugatti. Other brands include SEAT (family cars, Spain) and Skoda (family cars, the Czech Republic). Late in 2009 VW acquired a 49.9% stake in Porsche for about E4 billion (almost $6 billion) as the first step in combining the two into an integrated car company.",N/A
Air Products,10000+ Employees,"Allentown, PA",Chemical Manufacturing,4.1,4.2,3.9,3.5,3.5,3.8,3.6,See All 781 Reviews,"Air Products (NYSE:APD) is a world-leading Industrial Gases company in operation for 80 years. The Company provides industrial gases and related equipment to dozens of industries, including refining, chemical, metals, electronics, manufacturing, and food and beverage. Air Products is also the world’s leading supplier of liquefied natural gas process technology and equipment. The Company develops, engineers, builds, owns and operates some of the world's largest industrial gas projects, including gasification projects that sustainably convert abundant natural resources into syngas for the production of high-value power, fuels and chemicals.

The Company had fiscal 2020 sales of $8.9 billion from operations in 50 countries and has a current market capitalization of about $55 billion. More than 19,000 passionate, talented and committed employees from diverse backgrounds are driven by Air Products’ higher purpose to create innovative solutions that benefit the environment, enhance sustainability and address the challenges facing customers, communities, and the world.",N/A
TBC,5001 to 10000 Employees,"Palm Beach Gardens, FL",Automotive Parts & Accessories Stores,4.1,4.5,4.1,4.2,4.1,4.1,4.1,See All 277 Reviews,"TBC Corporation is a leader in the tire and auto-services aftermarket with a corporate portfolio of more than a dozen brands. For more than 60 years, we have offered our customers the highest-quality tires and expert automotive services.

Our company-owned Retail brands include NTB® and Tire Kingdom®. Our Franchise brands includes Midas® and Big O Tires®. And, we are home to NTW, Tire America, TBC Brands, TBC de Mexico, TBC International, Fleet America and R.O. Writer.",N/A
Ingram Content Group,1001 to 5000 Employees,"La Vergne, TN",Publishing,4.1,4.1,4.2,3.9,4.0,4.0,4.1,See All 335 Reviews,"Ingram Content Group is the world’s largest and most trusted distributor of physical and digital content. If you are reading a book, Ingram Content Group is probably behind it. Ingram is the leader in helping content reach its destination anywhere in the world. Whether digital or physical content, Ingram delivers to mobile phones, tablets, online retailers, bookstores, libraries, schools and consumers across the globe. Our company is on the cutting edge of technology in automated manufacturing, digital content distribution and e-learning platforms, and is trusted by publishers, retailers, and libraries for digital and physical solutions. With almost 50 years in the book business, Ingram is a forward-thinking company that got its start as a textbook depository, but has grown and transformed to become the leader in our industry. Ingram is committed to developing technology solutions that make physical and digital books available to readers around the world.",N/A
Workfront,1001 to 5000 Employees,"Lehi, UT",Computer Hardware & Software,4.1,4.7,4.1,3.9,3.8,4.1,3.6,See All 403 Reviews,Workfront is an enterprise work management platform designed to connect people to work and accelerate organizational success across the enterprise.,N/A
Learfield IMG College,1001 to 5000 Employees,"Plano, TX",Advertising & Marketing,4.1,3.4,3.8,3.6,3.9,3.4,3.8,See All 229 Reviews,"Welcome to Learfield IMG College, a new company introduced on Dec. 31, 2018, when our merger was completed. Individually, our two companies not only share deep roots within intercollegiate athletics, but strong relationships, experiences and resources. By coming together as one, we’re now better equipped than ever to help our clients grow their brands.

At the core of our business, we do have the distinct privilege of representing an incredible collection of collegiate institutions, conferences and arenas all across the country. We value these relationships and appreciate them trusting us with their brand.

On a much broader level, our new company is a fully integrated sports marketing and solutions platform providing college properties access to licensing and multimedia sponsorship management; publishing, radio, digital and social media; fan engagement, ticket sales and professional concessions expertise; branding; campus-wide business and sponsorship development; and venue technology systems.",N/A
North American Dental Group,1001 to 5000 Employees,"Pittsburgh, PA",Health Care Services & Hospitals,4.1,2.4,4.2,4.1,4.1,4.1,4.2,See All 207 Reviews,"Pioneering a new culture of dentistry.

Pioneers don’t blaze a trail because they can, they do it because they must. They honor their long-held desires to change their lives for the better, leaving behind a blue print for the next generation to find. Once we realize what we are capable of, we must find a way to unlock and realize that potential.

Our philosophy as a dental service organization is simple. Our desire to pioneer a new culture in dentistry starts with supporting good people. It is not enough to simply put our like-minds in the same room. We are committed to providing the ultimate freedom and individuality, to those supported dentists who want to do the right thing for the patient, and for each other.

As a dental service organization, we empower those dentists with the right goal in mind, who would otherwise go it alone, by providing them with a strong group of individuals for focus and support. We use proven methods in administration that we have learned over a decade’s time, paired with growth initiatives that will guide us to where we are going, to pioneer a future in dentistry that we all want to be a part of.",N/A
ByteDance,10000+ Employees,"Beijing, China",Internet,4.1,4.0,4.0,3.2,3.7,4.1,4.1,See All 549 Reviews,"ByteDance is a global technology company operating a range of platforms that allow people across languages, cultures and geographies to create, discover and connect. We now have a portfolio of applications available in over 150 markets and 75 languages, which includes TikTok, Helo, Douyin, Resso, Lark, Toutiao, and BaBe",N/A
Cohesity,1001 to 5000 Employees,"San Jose, CA",Computer Hardware & Software,4.1,4.5,3.9,3.5,3.9,4.1,4.0,See All 198 Reviews,"Cohesity is redefining data management from the ground up to solve a critical challenge facing businesses today: mass data fragmentation. Most enterprise data — backups, archives, file shares, object stores, and data used for test/dev and analytics — sits in fragmented infrastructure silos that make it hard to protect, expensive to manage, and difficult to analyze. Cohesity consolidates silos onto one web-scale platform, spanning on-premises, cloud, and the edge, and uniquely empowers organizations to run apps on that platform — making it easier than ever to back up and extract insights from data.

We’re a values-led company looking for great people who love challenges, are collaborative and curious, unafraid to try, and passionate about customer success.

Visit our website and blog, follow us on Twitter and LinkedIn and like us on Facebook.",N/A
VIAVI Solutions,1001 to 5000 Employees,"San Jose, CA",Telecommunications Manufacturing,4.0,4.3,4.0,4.0,3.7,3.7,3.4,See All 250 Reviews,"Today’s business technology demands are incredibly dynamic, and VIAVI is a global leader in network and service enablement and optical security and performance products. Think 5G, 3-D Sensing, and Fiber just to name a few.

Our technologies keep pace with the ever-changing needs of customers in all the markets we serve – from the world’s largest mobile operators and governmental entities, to enterprise network and application providers, to those who lay the fiber and build the towers that keep us connected.

Only VIAVI has the deep expertise necessary to create instruments and technologies that give our customers the power to successfully deploy, optimize, evolve and control the most complex networks on Earth, while remaining a global leader in the management of light, renowned for expertise in optical coatings.

Join VIAVI and help us build the solutions that drive customer success!",N/A
The Trade Desk,1001 to 5000 Employees,"Ventura, CA",Internet,4.0,4.2,3.9,3.7,3.6,4.2,3.7,See All 212 Reviews,"The Trade Desk is changing the way global brands and their agencies advertise to audiences around the world. Our media-buying platform helps deliver a more insightful and relevant ad experience for consumers — and sets a new standard for global reach, accuracy, and transparency.

For the past 11 years, we've been transforming media for the benefit of humankind. We’re passionate about keeping the internet free and open to everyone, because when content creators thrive, the internet as a whole prospers — free of the restrictions from a few big companies.

So if you’re talented, driven, creative, and hungry to bring something entirely new and wildly ambitious into the world (and have some fun doing it), then we want to talk.",N/A
Penn Medicine,10000+ Employees,"Philadelphia, PA",Health Care Services & Hospitals,4.0,4.1,3.8,3.5,3.4,3.9,3.8,See All 727 Reviews,"Penn Medicine’s mission is to advance knowledge and improve health through research, patient care, and the education of trainees in an inclusive culture that embraces diversity, fosters innovation, stimulates critical thinking, supports lifelong learning, and sustains our legacy of excellence.

Penn Medicine includes six acute-care hospitals and hundreds of outpatient centers throughout the region. Our hospitals include The Hospital of the University of Pennsylvania, Penn Presbyterian Medical Center, Pennsylvania Hospital, Chester County Hospital, Lancaster General Health and Penn Medicine Princeton Health.

We are consistently recognized nationally and internationally for excellence in health care. The cornerstone of our reputation is our medical and support staff, who choose to dedicate their careers to serving the needs of our patients and community.

The Hospitals of the University of Pennsylvania — Penn Presbyterian are proud to once again be ranked among the top hospitals in the nation and the #1 hospital in Pennsylvania by U.S. News & World Report's Honor Roll of Best Hospitals.


Stay connected at: http://pennmedicine.org/stay-connected",N/A
Maryland-National Capital Park and Planning Commission,1001 to 5000 Employees,"Riverdale, MD",State & Regional Agencies,4.0,4.4,4.0,3.9,3.4,3.4,3.5,See All 136 Reviews,"The Maryland-National Capital Park and Planning Commission (M-NCPPC) is a bi-county agency empowered by the State of Maryland in 1927 to acquire, develop, maintain and administer a regional system of parks within Montgomery and Prince George's Counties, and to provide land use planning for the physical development of Prince George's and Montgomery counties. In addition, the agency gained responsibility for the public recreation program in Prince George's County in 1970.

M-NCPPC administers a park system of more than 52,000 acres. It is composed of stream valley parks, large regional parks, neighborhood parks and park-school recreation areas. Its staff of career employees includes planners, park and recreation administrators, park police and administration staff. In addition, seasonal workers staff numerous park and recreation programs.","Mission: Throughout 90-plus years of service, The Maryland-National Capital Park and Planning Commission (M-NCPPC) has endeavored to improve the quality of life for all of the citizens of the bi-county area it serves and of the communities in which these citizens live, work and raise their families. M-NCPPC's mission is to:

Manage physical growth and plan communities.
Protect and steward natural, cultural and historic resources.
Provide leisure and recreational experiences."
